question	options_formatted	correct_letter	answer	category	meta_info
An 18-year-old woman comes to the physician because of worsening headache and exertional dyspnea for 6 days. Two months ago, she had a spontaneous abortion. Since then, she has had intermittent bloody vaginal discharge. Pelvic examination shows blood at the cervical os and a tender, mildly enlarged uterus. A urine pregnancy test is positive. An x-ray of the chest shows multiple round opacities in both lungs. Dilation and curettage is performed. Histopathology of the curettage specimen is most likely to show which of the following findings?	A. Whorled pattern of smooth muscle fibers surrounded by a pseudocapsule | B. Poorly differentiated glandular cells with myometrial invasion | C. Cytotrophoblasts and syncytiotrophoblasts without chorionic villi | D. Glomeruli-like central blood vessels enveloped by germ cells | E. Trophoblast hyperplasia with mixture of edematous and normal villi	C	Cytotrophoblasts and syncytiotrophoblasts without chorionic villi	OBSTETRICS	step1
A 79-year-old woman comes to the physician because of a 1-month history of difficulty starting urination and a vague sensation of fullness in the pelvis. Pelvic speculum examination in the lithotomy position shows a pink structure at the vaginal introitus that protrudes from the anterior vaginal wall when the patient is asked to cough. Which of the following is the most likely cause of this patient's symptoms?	A. Uterine prolapse | B. Vaginal rhabdomyosarcoma | C. Cystocele | D. Rectocele | E. Uterine leiomyomata	C	Cystocele	GYNECOLOGY	step1
A 55-year-old woman comes to the physician with concerns about swelling and pain in her right breast. Physical examination shows erythema and prominent pitting of the hair follicles overlying the upper and lower outer quadrants of the right breast. There are no nipple changes or discharge. A core needle biopsy shows invasive carcinoma of the breast. Which of the following is the most likely explanation for this patient's skin findings?	A. Bacterial invasion of the subcutaneous tissue | B. Obstruction of the lymphatic channels | C. Involution of the breast parenchyma and ductal system | D. Infiltration of the lactiferous ducts | E. Tightening of the suspensory ligaments	B	Obstruction of the lymphatic channels	GYNECOLOGY	step1
A 36-year-old primigravid woman at 15 weeks' gestation comes to the physician for a routine prenatal visit. She has not been taking prenatal vitamins and admits to consuming alcohol regularly. Pelvic examination shows a uterus consistent in size with a 15-week gestation. A quadruple screening test shows markedly elevated maternal serum α-fetoprotein. Maternal serum concentrations of β-human chorionic gonadotropin, estriol, and inhibin A are normal. Which of the following is the most likely explanation for these findings?	A. Fetal alcohol syndrome | B. Trisomy 21 | C. Partial molar pregnancy | D. Holoprosencephaly | E. Spina bifida cystica | F. Trisomy 18	E	Spina bifida cystica	OBSTETRICS	step1
A 37-year-old woman, gravida 3, para 3, comes to the physician for a follow-up examination. She gave birth to her third child 8 months ago and now wishes to start a contraception method. Prior to her most recent pregnancy, she used a combined estrogen-progestin pill. Which of the following aspects of her history would be a contraindication for restarting an oral contraceptive pill?	A. Her hemoglobin A1c is 8.6% | B. She smokes 1 pack of cigarettes daily | C. She has recurrent migraine headaches without aura | D. She has a history of cervical dysplasia | E. Her father had an ischemic stroke | F. Her infant is still breastfeeding	B	She smokes 1 pack of cigarettes daily	REPRODUCTIVE_HEALTH	step1
A previously healthy 29-year-old woman, gravida 1, para 0, at 35 weeks' gestation comes to the physician for a routine prenatal visit. Current medications include folic acid and a multivitamin. A rectovaginal swab culture grows bacitracin-resistant colonies of gram-positive cocci with surrounding areas of clear hemolysis. Which of the following is the most appropriate intervention to decrease vertical transmission of this organism?	A. Schedule delivery of the fetus via C-section | B. Administer benzathine pencillin G now | C. Abstain from breastfeeding | D. Administer ampicillin intrapartum | E. Perform amniocentesis at 37 weeks | F. Administer intravenous immune globulin postpartum	D	Administer ampicillin intrapartum	OBSTETRICS	step1
Thirty minutes after normal vaginal delivery of twins, a 35-year-old woman, gravida 5, para 4, has heavy vaginal bleeding with clots. Physical examination shows a soft, enlarged, and boggy uterus. Despite bimanual uterine massage, administration of uterotonic drugs, and placement of an intrauterine balloon for tamponade, the bleeding continues. A hysterectomy is performed. Vessels running through which of the following structures must be ligated during the surgery to achieve hemostasis?	A. Suspensory ligament | B. Uterosacral ligament | C. Cardinal ligament | D. Round ligament | E. Ovarian ligament	C	Cardinal ligament	OBSTETRICS	step1
A 38-year-old woman comes to the physician because of a 2-day history of a red, itchy, burning rash on her vulva. She has had three similar episodes over the last two years that have all self-resolved. Genitourinary examination shows a small area of erythema with an overlying cluster of vesicles on the inside surface of the vulva. Latent infection of which of the following is most likely responsible for this patient's recurrent symptoms?	A. Macrophages | B. Sensory neurons | C. Monocytes | D. Astrocytes | E. T cells	B	Sensory neurons	GYNECOLOGY	step1
A 15-year-old girl is brought to the physician for her annual physical examination. Breast and pubic hair development began at the age of 12 years, but menses have not yet occurred. She is 160 cm (5 ft 3 in) tall and weighs 54 kg (120 lb); BMI is 21 kg/m2. Physical examination shows normal external genitalia. Breast and pubic hair development are Tanner stage 5. A pelvic ultrasound shows normal ovaries but an absent uterus. These findings are most likely due to a defect in which of the following embryologic structures?	A. Mesonephric duct | B. Genital tubercle | C. Gubernaculum | D. Urogenital sinus | E. Paramesonephric duct	E	Paramesonephric duct	GYNECOLOGY	step1
"One day after delivery, an African American female newborn develops yellow discoloration of the eyes. She was born at term via uncomplicated vaginal delivery and weighed 3.4 kg (7 lb 8 oz). Her mother did not receive prenatal care. Examination shows scleral icterus and mild hepatosplenomegaly. Laboratory studies show:\nHemoglobin 10.7 mg/dL\nReticulocytes 3.5%\nMaternal blood group 0, Rh-negative\nAnti-Rh antibody titer positive\nFetal blood group A, Rh-negative\nSerum\nBilirubin, total 6.1 mg/dL\nDirect 0.4 mg/dL\nWhich of the following is the most likely cause of this patient's condition?"""	A. Viral infiltration of the bone marrow | B. Polymerization of deoxygenated hemoglobin | C. Atresia of the bilary tract | D. Impaired regeneration of reduced glutathione | E. Transfer of Anti-A antibodies | F. Binding of Rhesus immune globulins	E	Transfer of Anti-A antibodies	OBSTETRICS	step1
A 22-year-old woman comes to the physician for a routine health maintenance examination. She has no history of serious illness. Pelvic examination shows a pink, 2 x 2-cm, fluctuant swelling at the right posterior vaginal introitus. The swelling is most likely derived from which of the following structures?	A. Vulvar epithelium | B. Paraurethral glands | C. Greater vestibular glands | D. Mesonephric duct remnants | E. Sebaceous glands	C	Greater vestibular glands	GYNECOLOGY	step1
A 28-year-old woman, gravida 1, para 0, at 24 weeks' gestation comes to the physician for a prenatal visit. She feels well. She has no history of medical illness and takes no medications. Her fasting serum glucose is 91 mg/dL. One hour after drinking a concentrated glucose solution, her serum glucose concentration is 94 mg/dL. The hormone responsible for the observed laboratory changes most likely increases glucose transport into which of the following types of cells?	A. Spermatocytes | B. Islet cells | C. Adipocytes | D. Astrocytes | E. Hepatocytes | F. Placental cells | G. Erythrocytes	C	Adipocytes	OBSTETRICS	step1
A 58-year-old woman comes to the physician for evaluation of vaginal dryness and pain during sexual intercourse with her husband. Four months ago, she was diagnosed with metastatic breast cancer and is currently undergoing chemotherapy. She has smoked one pack of cigarettes daily for 15 years but quit when she was diagnosed with breast cancer. Physical examination shows thinning of the vaginal mucosa. A dual-energy x-ray absorptiometry (DXA) study of her hip shows a T-score of -2.6. Six months ago, her T-score was -1.6. Which of the following drugs is most likely exacerbating this patient's symptoms?	A. Raloxifene | B. Palbociclib | C. Paclitaxel | D. Trastuzumab | E. Tamoxifen | F. Exemestane	F	Exemestane	GYNECOLOGY	step1
Two months after giving birth to a boy, a 27-year-old woman comes to the physician with her infant for a well-child examination. She was not seen by a physician during her pregnancy. Physical examination of the mother and the boy shows no abnormalities. Laboratory studies show elevated titers of hepatitis B surface antigen in both the mother and the boy. Which of the following statements regarding the infant's condition is most accurate?	A. Hepatitis B e antigen titer is likely undetectable | B. Chronic infection is unlikely | C. Lifetime risk of hepatocellular carcinoma is low | D. The viral replication rate is low | E. Significant elevation of transaminases is not expected | F. Breastfeeding should be avoided	E	Significant elevation of transaminases is not expected	OBSTETRICS	step1
A 42-year-old woman, gravida 5, para 5, comes to the physician because of a 6-month history of occasional involuntary urine loss that is exacerbated by coughing, sneezing, and laughing. She has no urgency or dysuria. Physical examination shows normal appearing external genitalia, vagina, and cervix. There is a loss of urine with the Valsalva maneuver. The physician recommends doing Kegel exercises. Which of the following muscles is strengthened by these exercises?	A. Compressor urethrae | B. Internal urethral sphincter | C. Sphincter urethrae | D. Levator ani | E. Deep transverse perineal muscles	D	Levator ani	GYNECOLOGY	step1
A 47-year-old woman comes to the physician because of involuntary leakage of urine for the past 4 months, which she has experienced when bicycling to work and when laughing. She has not had any dysuria or urinary urgency. She has 4 children that were all delivered vaginally. She is otherwise healthy and takes no medications. The muscles most likely affected by this patient's condition receive efferent innervation from which of the following structures?	"A. S1-S2 nerve roots | B. Superior gluteal nerve | C. Superior hypogastric plexus | D. Obturator nerve | E. S3–S4 nerve roots | F. Ilioinguinal nerve\n"""	E	S3–S4 nerve roots	GYNECOLOGY	step1
A 26-year-old primigravid woman at 25 weeks' gestation comes to the physician for a prenatal visit. She has no history of serious illness and her only medication is a daily prenatal vitamin. A 1-hour 50-g glucose challenge shows a glucose concentration of 167 mg/dL (N < 135). A 100-g oral glucose tolerance test shows glucose concentrations of 213 mg/dL (N < 180) and 165 mg/dL (N < 140) at 1 and 3 hours, respectively. If she does not receive adequate treatment for her condition, which of the following complications is her infant at greatest risk of developing?	A. Restricted growth | B. Elevated calcium levels | C. Islet cell hyperplasia | D. Decreased amniotic fluid production | E. Omphalocele | F. Decreased hematocrit	C	Islet cell hyperplasia	OBSTETRICS	step1
A 37-year-old woman, gravida 4, para 3, at 35 weeks' gestation is admitted to the hospital in active labor. Her three children were delivered by Cesarean section. One hour after vaginal delivery, the placenta is not delivered. Manual separation of the placenta leads to profuse vaginal bleeding. Her pulse is 122/min and blood pressure is 90/67 mm Hg. A firm, nontender uterine fundus is palpated at the level of the umbilicus. Hemoglobin is 8.3 g/dL and platelet count is 220,000/mm3. Activated partial thromboplastin time and prothrombin time are within normal limits. Which of the following is the most likely underlying mechanism of this patient's postpartum bleeding?	A. Impaired uterine contractions | B. Consumption of intravascular clotting factors | C. Rupture of the uterine wall | D. Rupture of the fetal vessels | E. Defective decidual layer of the placenta	E	Defective decidual layer of the placenta	OBSTETRICS	step1
A 32-year-old woman, gravida 2, para 1, at 14-weeks' gestation comes to the physician for a prenatal visit. Routine first trimester screening shows increased nuchal translucency, decreased β-hCG concentration, and decreased levels of pregnancy-associated plasma protein A. Amniocentesis shows trisomy of chromosome 13. This fetus is at increased risk for which of the following?	A. Optic glioma | B. Cutis aplasia | C. Duodenal atresia | D. Cystic hygroma | E. Prominent occiput	B	Cutis aplasia	OBSTETRICS	step1
Thirty minutes after vaginal delivery of a 2780-g (6-lb 2-oz) newborn at term, a 25-year-old woman, gravida 1, para 1, has heavy vaginal bleeding. Her pregnancy was complicated by pre-eclampsia. Her pulse is 111/min and blood pressure is 95/65 mm Hg. Physical examination shows a fundal height 2 inches below the xiphoid process of the sternum. A drug with which of the following mechanisms of action is most appropriate for this patient?	A. Inhibition of norepinephrine reuptake | B. Activation of phospholipase C | C. Depolarization of the motor end plate | D. Increased synthesis of cyclic AMP | E. Binding to prostaglandin I2 receptors	B	Activation of phospholipase C	OBSTETRICS	step1
A 17-year-old girl is brought to the physician by her mother because she has not had her menstrual period yet. At birth, she had ambiguous genitalia. The mother reports that during the pregnancy she had noticed abnormal hair growth on her chin. A year ago, the girl broke her distal radius after a minor trauma. She is at the 95th percentile for height and 50th percentile for weight. Physical examination shows nodulocystic acne on the face, chest, and upper back. Breast development is at Tanner stage I. Pelvic examination reveals normal pubic hair with clitoromegaly. A pelvic ultrasound shows ovaries with multiple cysts and a normal uterus. Which of the following is the most likely diagnosis?	A. Aromatase deficiency | B. Turner syndrome | C. Kallmann syndrome | D. Congenital adrenal hyperplasia | E. Mullerian agenesis | F. Polycystic ovary syndrome	A	Aromatase deficiency	GYNECOLOGY	step1
A 28-year-old woman, gravida 1, para 0, at 32 weeks' gestation is admitted to the hospital for the management of elevated blood pressures. On admission, her pulse is 81/min, and blood pressure is 165/89 mm Hg. Treatment with an intravenous drug is initiated. Two days after admission, she has a headache and palpitations. Her pulse is 116/min and regular, and blood pressure is 124/80 mm Hg. Physical examination shows pitting edema of both lower extremities that was not present on admission. This patient most likely was given a drug that predominantly acts by which of the following mechanisms?	A. Inhibition of β1, β2, and α1 receptors | B. Activation of α2 adrenergic receptors | C. Inhibition of angiotensin II production | D. Inhibition of sodium reabsorption | E. Direct dilation of the arterioles | F. Inhibition of nondihydropyridine calcium channels	E	Direct dilation of the arterioles	OBSTETRICS	step1
A 32-year-old woman comes to the physician because she has been unable to conceive for 2 years. The patient also reports monthly episodes of pelvic and back pain accompanied by painful diarrhea for 6 years. She takes naproxen for the pain, which has provided some relief. Menses have occurred at regular 28-day intervals since menarche at the age of 11 years and last for 7 days. She is sexually active with her husband and does not use contraception. Pelvic and rectal examination shows no abnormalities. A hysterosalpingogram is unremarkable. Which of the following is the most likely underlying cause of this patient's symptoms?	A. Endometrial tissue outside the uterine cavity | B. Smooth muscle tumor arising from the myometrium | C. Primary failure of the ovaries | D. Decreased secretion of gonadotropin-releasing hormone | E. Scarring of the fallopian tubes | F. Increased secretion of androgens and luteinizing hormone | G. Activation of lymphatic cells in the intestinal walls	A	Endometrial tissue outside the uterine cavity	GYNECOLOGY	step1
A 59-year-old woman comes to the physician because of worsening shortness of breath for the past two weeks. Physical examination shows decreased breath sounds at both lung bases. The abdomen is distended and there is shifting dullness with a positive fluid wave. Ultrasound of the abdomen shows a large collection of peritoneal fluid and a hypoechoic mass involving the left ovary. Microscopic examination of a biopsy specimen from the ovarian mass shows clusters of spindle-shaped cells. Which of the following is the most likely diagnosis?	A. Serous cystadenoma | B. Endometrioma | C. Ovarian thecoma | D. Dermoid cyst | E. Ovarian fibroma	E	Ovarian fibroma	GYNECOLOGY	step1
A 29-year-old woman, gravida 1, para 0, at 36 weeks' gestation is brought to the emergency department after an episode of dizziness and vomiting followed by loss of consciousness lasting 1 minute. She reports that her symptoms started after lying down on her back to rest, as she felt tired during yoga class. Her pregnancy has been uncomplicated. On arrival, she is diaphoretic and pale. Her pulse is 115/min and blood pressure is 90/58 mm Hg. On examination, the patient is lying in the supine position with a fundal height of 36 cm. There is a prolonged fetal heart rate deceleration to 80/min. Which of the following is the most appropriate action to reverse this patient's symptoms in the future?	A. Performing the Muller maneuver | B. Lying in the supine position and elevating legs | C. Gentle compression with an abdominal binder | D. Lying in the left lateral decubitus position | E. Performing the hand grip maneuver | F. Performing the Valsava maneuver	D	Lying in the left lateral decubitus position	OBSTETRICS	step1
"A 37-year-old woman, gravida 3, para 2, at 32 weeks' gestation comes to the physician for a follow-up examination 2 days after an increased blood pressure measurement. She now reports having a headache and visual disturbances for the past 12 hours. Her only medication is a prenatal vitamin. Her temperature is 36.7°C (98.1°F), pulse is 90/min, and blood pressure is 164/80 mm Hg. Her blood pressure at her first-trimester prenatal visit was 110/70 mm Hg. Physical examination shows no abnormalities. Laboratory studies show:\nHemoglobin 12.5 g/dL\nPlatelet count 285,000/mm3\nSerum\nCreatinine 1.0 mg/dL\nUrine\nBlood negative\nProtein negative\nWhich of the following is the most likely primary component in the pathogenesis of this patient's condition?"""	A. Vasogenic cerebral edema | B. Increase in circulating plasma volume | C. Hyperperfusion of placental tissue | D. Abnormal remodeling of spiral arteries | E. Overactivation of the coagulation cascade	D	Abnormal remodeling of spiral arteries	OBSTETRICS	step1
A 22-year-old woman comes to the physician to discuss the prescription of an oral contraceptive. She has no history of major medical illness and takes no medications. She does not smoke cigarettes. She is sexually active with her boyfriend and has been using condoms for contraception. Physical examination shows no abnormalities. She is prescribed combined levonorgestrel and ethinylestradiol tablets. Which of the following is the most important mechanism of action of this drug in the prevention of pregnancy?	A. Thickening of cervical mucus | B. Inhibition of rise in luteinizing hormone | C. Suppression of ovarian folliculogenesis | D. Increase of sex-hormone binding globulin | E. Prevention of endometrial proliferation	B	Inhibition of rise in luteinizing hormone	REPRODUCTIVE_HEALTH	step1
A 19-year-old woman, gravida 1, para 0, at 21 weeks’ gestation comes to the physician for a follow-up prenatal visit. At her previous appointment, her serum α-fetoprotein concentration was elevated. She had smoked 1 pack of cigarettes daily for 3 years but quit at 6 weeks' gestation. Examination shows a uterus consistent in size with a 21-week gestation. Ultrasonography shows fetal viscera suspended freely into the amniotic cavity. Which of the following is the most likely diagnosis?	A. Vitelline fistula | B. Diaphragmatic hernia | C. Myelomeningocele | D. Umbilical hernia | E. Vesicourachal diverticulum | F. Gastroschisis | G. Omphalocele	F	Gastroschisis	OBSTETRICS	step1
A 35-year-old woman, gravida 2, para 2, comes to the physician with intermenstrual bleeding and heavy menses for the past 4 months. She does not take any medications. Her father died of colon cancer at the age of 42 years. A curettage sample shows dysplastic tall, columnar, cells in the endometrium without intervening stroma. Germline sequencing shows a mutation in the MLH1 gene. Which of the following is the most likely underlying cause of neoplasia in this patient?	A. Accumulation of double-stranded DNA breaks | B. Defective checkpoint control transitions | C. Inability to excise bulky DNA adducts | D. Instability of short tandem DNA repeats | E. Impaired repair of deaminated DNA bases	D	Instability of short tandem DNA repeats	GYNECOLOGY	step1
A 25-year-old man comes to the physician because he and his wife have been unable to conceive despite regular unprotected sex for the past 15 months without using contraception. His wife has been tested and is fertile. The patient began puberty at the age of 14 years. He was treated for Chlamydia trachomatis 6 years ago. He is a professional cyclist and trains every day for 3–4 hours. He feels stressed because of an upcoming race. His blood pressure is 148/92 mm Hg. Physical examination of the husband shows a tall, athletic stature with uniform inflammatory papular eruptions of the face, back, and chest. Genital examination shows small testes. Which of the following is the most likely underlying cause of this patient's infertility?	A. Psychogenic erectile dysfunction | B. Kallmann syndrome | C. Anabolic steroid use | D. Chlamydia infection | E. Scrotal hyperthermia | F. Klinefelter syndrome	C	Anabolic steroid use	REPRODUCTIVE_HEALTH	step1
A 2050-g (4.5-lb) female newborn and a 2850-g (6.3-lb) female newborn are delivered at 37 weeks' gestation to a 23-year-old, gravida 2, para 1 woman. The mother had no prenatal care. Examination of the smaller newborn shows a flattened nose and left-sided clubfoot. The hematocrit is 42% for the smaller newborn and 71% for the larger newborn. This pregnancy was most likely which of the following?	A. Monochorionic-diamniotic monozygotic | B. Dichorionic-diamniotic dizygotic | C. Monochorionic-monoamniotic monozygotic | D. Dichorionic-diamniotic monozygotic | E. Dichorionic-monoamniotic monozygotic | F. Conjoined twins	A	Monochorionic-diamniotic monozygotic	OBSTETRICS	step1
A 26-year-old primigravid woman comes to the emergency department because of a 10-hour history of vaginal bleeding and lower abdominal pain. She also had nausea and fatigue for the past 4 weeks. Her last menstrual period was 9 weeks ago. There is no history of medical illness. Vital signs are within normal limits. Pelvic examination shows a uterus consistent in size with a 9-week gestation. A urine pregnancy test is positive. β-HCG level is 108,000 mIU/mL (N < 5 mIU/mL). Transvaginal ultrasonography shows unclear, amorphous fetal parts and a large placenta with multiple cystic spaces. Which of the following is the most likely cause of this patient's condition?	A. Complete molar pregnancy | B. Inevitable abortion | C. Choriocarcinoma | D. Partial molar pregnancy | E. Placental abruption	D	Partial molar pregnancy	OBSTETRICS	step1
"A 2-day-old male newborn born at 39 weeks' gestation is brought to the physician because of yellowing of his skin. His mother received no prenatal care and the delivery was uncomplicated. She has no history of serious medical illness and has one other son who is healthy. Physical examination shows jaundice, hepatomegaly, and decreased muscle tone. Laboratory studies show:\nHemoglobin 9.4 g/dL\nMaternal blood type O\nPatient blood type O\nSerum\nBilirubin\nTotal 16.3 mg/dL\nDirect 0.4 mg/dL\nWhich of the following is the most likely underlying cause of this patient's condition?"""	A. Glucose-6-phosphate dehydrogenase deficiency | B. IgM antibody formation against A and B antigens | C. Biliary duct malformation | D. UDP-glucuronosyltransferase deficiency | E. IgG antibody formation against Rh antigen	E	IgG antibody formation against Rh antigen	OBSTETRICS	step1
An investigator is studying cellular regeneration of epithelial cells. She has obtained a tissue sample from a normal thyroid gland for histopathologic examination. It shows follicles lined by a single layer of cube-like cells with large central nuclei. Which of the following parts of the female reproductive tract is also lined by this type of epithelium?	A. Ovaries | B. Vagina | C. Endometrium | D. Fallopian tubes | E. Vulva | F. Cervix	A	Ovaries	GYNECOLOGY	step1
