question	options_formatted	correct_letter	answer	category	meta_info
A 37-year-old woman, G1P0, visits her gynecologist’s office for a routine prenatal checkup. During her quadruple screening test, her alpha-fetoprotein levels were increased while the β-hCG and pregnancy-associated plasma protein were decreased. There is also evidence of increased nuchal translucency on the scanning of the male fetus. A confirmatory test indicates signs of a genetic syndrome. The woman is counseled that her child will most likely have a severe intellectual disability. Physical features of this condition include polydactyly, cleft palate, micrognathia and clenched fists. This genetic condition also affects the formation of the brain and can lead to stillbirth. Most babies do not survive beyond the first year of life. Which of the following is responsible for this type of genetic syndrome?	A. In utero infections | B. Error in metabolism | C. Genomic imprinting | D. Nondisjunction of chromosomes | E. Autosomal dominant genes	D	Nondisjunction of chromosomes	OBSTETRICS	step2
A 25-year-old primigravida is admitted to the hospital at 36 weeks gestation with a severe frontal headache. The initial assessment shows her vital signs to be as follows: blood pressure, 170/90 mm Hg; heart rate, 85/min; respiratory rate; 15/min; and temperature, 36.9℃ (98.4℉). The fetal heart rate is 159/min. The patient’s physical examination is remarkable for pitting edema of the lower extremity. Dipstick urine assessment shows 2+ proteinuria. While being evaluated the patient has a generalized tonic-clonic seizure. Which of the following pharmacologic agents should be used to control the seizures?	A. Valproic acid | B. Diazepam | C. Phenytoin | D. Magnesium sulfate | E. Lamotrigine	D	Magnesium sulfate	OBSTETRICS	step2
A 44-year-old woman presents to the outpatient clinic after she ran into a minor car accident. She says that she did not see the other car coming from the side and this is not the first time this has happened. When asked about any health issues she expresses concerns about whitish discharge dripping from both of her nipples that soils her blouse often. She is sexually active and has missed her periods for the last 3 months which she attributes to early signs of menopause. She denies nausea, vomiting, or recent weight gain. She currently does not take any medication. A visual field test reveals loss of bilateral temporal vision. Which of the following tests would best aid in diagnosing this patient’s condition?	A. A urine pregnancy test | B. Serum prolactin levels | C. Serum estrogen and progesterone levels | D. A mammogram | E. Thyroid stimulating hormone levels	B	Serum prolactin levels	GYNECOLOGY	step2
A 35-year-old man attends an appointment with a fertility specialist together with his wife. The couple has been attempting to conceive for over 2 years but without success. She has recently undergone a comprehensive gynecological exam and all the results were normal. He states that he has no prior medical history to report. He says that he does have a low libido compared to other men of his age. On physical examination, he is observed to be of a lean build with a height of 6ft 3 inches with slight evidence of gynecomastia. His testes are small and underdeveloped. His lab tests show an elevation of LH and FSH, along with azoospermia. Which of the following is the most likely cause of this man’s infertility?	A. Absence of chloride channel | B. Primary ciliary dyskinesia | C. Androgen insensitivity | D. Absent GnRH production | E. Presence of Barr body	E	Presence of Barr body	REPRODUCTIVE_HEALTH	step2
A 23-year-old woman visits her obstetrician for an antenatal appointment. She is at the 24th week of gestation. She has had type 1 diabetes mellitus for 5 years and is on insulin. She also has mitral stenosis, for which she has been advised to undergo a balloon valvotomy. Her temperature is 37.1°C (98.7°F), blood pressure is 120/60 mm Hg, and pulse is 90/minute. Her random blood glucose is 220 mg/dL and HbA1C is 8.5%. She wants to discuss possible complications concerning her pregnancy. Which of the following cardiac complications is her infant at high risk for?	A. Hypertrophic obstructive cardiomyopathy | B. Transient hypertrophic cardiomyopathy | C. Tetralogy of Fallot | D. Ebstein anomaly | E. Mitral valve prolapse	B	Transient hypertrophic cardiomyopathy	OBSTETRICS	step2
An 80-year-old woman presents with fatigue and a 30-lb weight loss over the past 3 months. The patient states that her symptoms started with mild fatigue about 4 months ago, which have progressively worsened. She noticed that the weight loss started about 1 month later, which has continued despite no changes in diet or activity level. The past medical history is significant for a total abdominal hysterectomy (TAH), and bilateral salpingo-oophorectomy at age 55 for stage 1 endometrial cancer. The patient takes no current medications but remembers taking oral (estrogen/progesterone) contraceptives for many years. The menarche occurred at age 10, and the menopause was at age 50. There is no significant family history. The vital signs include: temperature 37.0℃ (98.6℉), blood pressure 120/75 mm Hg, pulse 97/min, respiratory rate 17/min, and oxygen saturation 98% on room air. The physical examination is significant for a palpable mass in the upper outer quadrant of the left breast. The mass is hard and fixed with associated axillary lymphadenopathy. The mammography of the left breast shows a spiculated mass in the upper outer quadrant. An excisional biopsy of the mass is performed, and the histologic examination reveals the following significant findings (see image). Immunohistochemistry reveals that the cells from the biopsy are estrogen receptor (ER)/progesterone receptor (PR) and human epidermal growth factor receptor-2 (HER-2)/neu positive. Which of the following is the most important indicator of a poor prognosis for this patient?	A. Axillary lymphadenopathy | B. Increased age | C. ER positive | D. Inflammatory subtype | E. HER-2/neu positive	A	Axillary lymphadenopathy	GYNECOLOGY	step2
A 26-year-old nullipara presents to her physician for a routine check-up at 18 weeks gestation. She has no co-morbidities. Her only complaints are fatigability and a depressed mood for the past 2 weeks. Her vital signs are as follows: blood pressure, 125/80 mm Hg; heart rate, 87/min; respiratory rate, 14/min; and temperature, 36.7℃ (98℉). The physical examination is unremarkable and the gynecologic examination is consistent with 18 weeks gestation. A thyroid profile s ordered to check for a possible cause of the fatigability and decreased mood:\nThyroid stimulating hormone (TSH) 0.3 mU/L\nTotal T4 160 nmol/L\nFree T4 13 pmol/L\nCorresponding to the obtained results, how should the patient be managed?	A. Prescribe levothyroxine 50 mcg daily | B. No specific management required | C. Recommend additional anti-TPO test | D. Prescribe methimazole 10 mg daily | E. Recommend additional T3 assessment	B	No specific management required	OBSTETRICS	step2
A 21-year-old gravida 1, para 0 woman presents to the family medicine clinic for her first prenatal appointment. She states that she has been taking folic acid supplements daily as directed by her mother. She smokes a few cigarettes a day and has done so for the last 5 years. Pediatric records indicate the patient is measles, mumps, and rubella non-immune. Her heart rate is 78/min, respiratory rate is 14/min, temperature is 36.5°C (97.7°F), and blood pressure is 112/70 mm Hg. Her calculated BMI is approximately 26 kg/m2.  Her heart is without murmurs and lung sounds are clear bilaterally. Standard prenatal testing is ordered. Which of the following is the next best step for this patient’s prenatal care?	A. MMR vaccine postpartum | B. MMR vaccine during pregnancy | C. Serology, then vaccine postpartum | D. Serology, then vaccine during pregnancy | E. MMR vaccine and immune globulin postpartum	A	MMR vaccine postpartum	OBSTETRICS	step2
A 64-year-old woman presents to the surgical oncology clinic as a new patient for evaluation of recently diagnosed breast cancer. She has a medical history of type 2 diabetes mellitus for which she takes metformin. Her surgical history is a total knee arthroplasty 7 years ago. Her family history is insignificant. Physical examination is notable for an irregular nodule near the surface of her right breast. Her primary concern today is which surgical approach will be chosen to remove her breast cancer. Which of the following procedures involves the removal of a portion of a breast?	A. Vasectomy | B. Mastectomy | C. Lumpectomy | D. Arthroplasty | E. Laminectomy	C	Lumpectomy	GYNECOLOGY	step2
A 28-year-old woman presents to an outpatient clinic for a routine gynecologic examination. She is concerned about some swelling on the right side of her vagina. She senses that the right side is larger than the left and complains that sometimes that area itches and there is a dull ache. She denies any recent travel or history of trauma. She mentions that she is sexually active in a monogamous relationship with her husband; they use condoms inconsistently. On physical examination her vital signs are normal. Examination of the pelvic area reveals a soft, non-tender, mobile mass that measures approximately 2 cm in the greatest dimension at the 8 o’clock position on the right side of the vulva, just below the vaginal wall. Which of the following is the most likely diagnosis?	A. Condylomata acuminata | B. Bartholin duct cyst | C. Vulvar hematoma | D. Molluscum contagiosum | E. Squamous cell carcinoma	B	Bartholin duct cyst	GYNECOLOGY	step2
A 48-year-old woman with a known past medical history significant for hypertension presents for a second opinion of a left breast lesion. The lesions were characterized as eczema by the patient’s primary care physician and improved briefly after a trial of topical steroids. However, the patient is concerned that the lesions have started to grow. On physical examinations, there is an erythematous, scaly lesion involving the left breast nipple-areolar complex with weeping drainage. What is the next step in the patient’s management?	A. Bilateral breast ultrasound | B. Punch biopsy of the nipple, followed by bilateral mammography | C. Maintain regular annual mammography appointment | D. Oral corticosteroids | E. Left breast MRI	B	Punch biopsy of the nipple, followed by bilateral mammography	GYNECOLOGY	step2
A 31-year-old female presents to her primary care physician with mild anxiety and complaints of mood swings lasting several months. The patient reports that the mood swings affect her work and personal relationships. In addition, she complains of increased irritability, breast tenderness, bloating, fatigue, binge-eating, and difficulty concentrating for 10 days prior to her menstrual period. The patient's symptoms increase in severity with the approach of menses but resolve rapidly on the first day of menses. She states that she is very sensitive to criticism of her work by others. She also snaps at her children and her husband. She has tried yoga to unwind, but with limited improvement. She is concerned that her behavior is affecting her marriage. The patient has no past medical history, and has regular periods every 24 days. She has had two normal vaginal deliveries. She uses condoms for contraception. Her mother has major depressive disorder. The physical exam is unremarkable. What is the most appropriate next step in the treatment of this patient?	A. Anxiolytic therapy | B. Selective serotonin reuptake inhibitors (SSRIs) | C. Oral contraceptive and nonsteroidal anti-inflammatory drugs (NSAIDs) | D. Gonadotropin-releasing hormone (GnRH) agonists | E. Nonserotonergic antidepressants	C	Oral contraceptive and nonsteroidal anti-inflammatory drugs (NSAIDs)	GYNECOLOGY	step2
A 65-year-old G2P2 presents to her physician for a routine gynecologic check-up. She has been menopausal since 54 years of age, but has not been on hormone replacement therapy. Both pregnancies and deliveries were uneventful. Her husband has been her only sexual partner for the past 30 years. At 45 years of age she underwent a myomectomy for a submucosal uterine fibroid. She has never had any menstrual cycle disturbances. She does not smoke cigarettes and drinks alcohol occasionally. She has had normal Pap smears for the past 30 years. She also had HPV screening 5 years ago with the Pap smear. The co-test results were negative. Her Pap smear at 42 years of age showed a low-grade intraepithelial lesion, but the colposcopy was normal, and the subsequent Pap smear were normal. The screening tests obtained at the current presentation show the following results:\nPap test HPV test\nSpecimen adequacy: satisfactory for evaluation\nInterpretation: negative for intraepithelial lesion or malignancy\nComments: atrophic cellular pattern\nnegative\nWhich of the following would be the most appropriate consideration regarding further screening of this patient?	A. Pap smear and HPV co-testing should be performed every 5 years | B. The Pap smear should be repeated every 3 years | C. Discontinuing screening in this patient should be considered | D. Pap smears should be repeated every 5 years | E. The Pap smear should be repeated after 1 week of vaginal estrogen cream application, and a definitive decision should be made based on the results of the re-testing	C	Discontinuing screening in this patient should be considered	GYNECOLOGY	step2
A 34-year-old G3P2 presents at 33 weeks gestation with several episodes of bloody spotting and mild vaginal bleeding over the past 2 weeks. The bleeding has no specific triggers and resolves spontaneously. She does not report abdominal pain or uterine contractions. She has had two cesarean deliveries. At 20 weeks gestation, the ultrasound examination showed the placental edge to be 5 cm away from the internal cervical os. On examination at this visit, the vital signs are as follows: blood pressure, 110/70 mm Hg; heart rate, 89/min; respiratory rate, 15\min; and temperature, 36.6℃ (97.9℉). The uterus is tender with no palpable contractions and streaks of blood are noted on the perineum, but there is no active bleeding. An ultrasound evaluation shows the placental edge 1 cm from the internal cervical os. Which of the following options best describes the placental position at each ultrasound?	A. Normally lying placenta → marginal previa | B. Low-lying placenta → partial previa | C. Normally placed placenta → low-lying placenta | D. Marginal previa → partial previa | E. Low-lying placenta → marginal previa	A	Normally lying placenta → marginal previa	OBSTETRICS	step2
A 62-year-old woman presents to the primary care physician with complaints of urinary leakage over the last 2 months. History reveals that the leakage occurred when she sneezed, laughed, or coughed. Her menopause occurred 11 years ago and she is a mother of 3 children. Vital signs include blood pressure 120/80 mm Hg, heart rate 84/min, respiratory rate 18/min, and temperature 36.6°C (98.0°F). Physical examination is unremarkable. Urinalysis reveals:\nColor Yellow\nClarity/turbidity Clear\npH 5.5\nSpecific gravity 1.015\nNitrites Negative\nLeukocyte esterase Negative\nWhich of the following is the best initial management for this patient?	A. Antimuscarinics | B. Kegel exercises | C. Placement of the catheter | D. Urethropexy | E. Pessary insertion	B	Kegel exercises	GYNECOLOGY	step2
A 27-year-old woman, gravida 1, at 26 weeks gestation presents to the physician during a prenatal visit. She feels well. Her pregnancy has been uncomplicated. Her initial laboratory tests at 8 weeks confirmed her blood type as B-. Her partner is blood type A+. At the clinic, her temperature is 37.2°C (99.0°F), and blood pressure is 108/60 mm Hg. Pelvic examination shows a uterus consistent in size with a 24-week gestation. Fetal heartbeats are normal. A sample of blood is collected for blood type screening and verification. Regarding Rh D immunoglobulin (RhoGam) administration, the most appropriate next step is which of the following?	A. At 28 weeks gestation if anti-D screen is negative | B. At 28 weeks gestation if anti-D screen is positive | C. Within 72 hours after birth if anti-D screen is negative | D. Within 72 hours after birth if anti-D screen is positive | E. Rh D immunoglobulin (RhoGam) is not required in this patient regardless of test results	A	At 28 weeks gestation if anti-D screen is negative	OBSTETRICS	step2
A 37-year-old G4P3 presents to her physician at 20 weeks gestation for routine prenatal care. Currently, she has no complaints; however, in the first trimester she was hospitalized due to acute pyelonephritis and was treated with cefuroxime. All her past pregnancies required  cesarean deliveries for medical indications. Her history is also significant for amenorrhea after weight loss at 19 years of age and a cervical polypectomy at 30 years of age. Today, her vital signs are within normal limits and a physical examination is unremarkable. A transabdominal ultrasound shows a normally developing male fetus without morphologic abnormalities, anterior placement of the placenta in the lower uterine segment, loss of the retroplacental hypoechoic zone, and visible lacunae within the myometrium. Which of the following factors present in this patient is a risk factor for the condition she has developed?	A. Genitourinary infections during pregnancy | B. Cervical surgery | C. A history of amenorrhea | D. Multiple cesarean deliveries | E. Intake of antibiotics in the first trimester	D	Multiple cesarean deliveries	OBSTETRICS	step2
A 50-year-old obese woman presents for a follow-up appointment regarding microcalcifications found in her left breast on a recent screening mammogram. The patient denies any recent associated symptoms. The past medical history is significant for polycystic ovarian syndrome (PCOS), for which she takes metformin. Her menarche occurred at age 11, and the patient still has regular menstrual cycles. The family history is significant for breast cancer in her mother at the age of 72. The review of systems is notable for a 6.8 kg (15 lb) weight loss in the past 2 months. The vital signs include: temperature 37.0°C (98.6°F), blood pressure 130/70 mm Hg, pulse 82/min, respiratory rate 17/min, and oxygen saturation 98% on room air. On physical examination, the patient is alert and cooperative. The breast examination reveals no palpable masses, lymphadenopathy, or evidence of skin retraction. An excisional biopsy of the left breast is performed, and histologic examination demonstrates evidence of non-invasive malignancy. Which of the following is the most appropriate course of treatment for this patient?	A. Observation with bilateral mammograms every 6 months | B. Tamoxifen | C. Radiotherapy | D. Lumpectomy | E. Bilateral mastectomy	D	Lumpectomy	GYNECOLOGY	step2
A 28-year-old woman returns to the clinic to follow up on a recent abnormal cervical biopsy that demonstrated cervical intraepithelial neoplasia (CIN) I. The patient is quite anxious about the implications of this diagnosis. Her physical examination is within normal limits. Her vital signs do not show any abnormalities at this time. Her past medical, family, and social histories are all non-contributory. Which of the following is the appropriate management of a newly diagnosed CIN I in a 24-year-old patient?	A. Close observation, pap smear screening at 6 and 12 months, and HPV DNA testing at 12 months | B. Cryotherapy ablation | C. Laser ablation | D. Loop electrosurgical excision (LEEP) | E. Hysterectomy	A	Close observation, pap smear screening at 6 and 12 months, and HPV DNA testing at 12 months	GYNECOLOGY	step2
A 31-year-old woman, gravida 2, para 1, at 32 weeks' gestation presents to the emergency department for clear vaginal discharge that started roughly 26 hours ago. Her pregnancy has been uncomplicated. Her first child was born at term by vaginal delivery. She has no history of any serious illnesses. She does not drink alcohol or smoke cigarettes. Current medications include vitamin supplements. Her temperature is 37.2°C (98.9°F), pulse is 70/min, respirations are 18/min, and blood pressure is 128/82 mm Hg. Speculum examination demonstrates clear fluid at the cervical os. The fetal heart rate is reactive at 160/min with no decelerations. Tocometry shows uterine contractions. Nitrazine testing is positive. She is started on indomethacin. Which of the following is the most appropriate next step in management?	A. Administer ampicillin and perform amnioinfusion | B. Administer ampicillin and progesterone | C. Administer ampicillin and test amniotic fluid for fetal lung maturity | D. Administer betamethasone, ampicillin, and proceed with cesarean section | E. Administer betamethasone, ampicillin, and proceed with induction of labor	D	Administer betamethasone, ampicillin, and proceed with cesarean section	OBSTETRICS	step2
A 48-year-old woman presents with a 15-year history of long, painful menses that is only partially relieved with oral contraceptives. She desires definitive treatment. She denies weight loss or post-coital bleeding, and her husband has been her only sexual partner. She does not have a history of smoking, alcohol or illicit drug use, or sexually transmitted diseases. She sees her gynecologist annually. She takes no medications. An abdominal ultrasound shows a non-gravid uterus with hyperechoic islands and an irregular endometrial-myometrial junction, consistent with adenomyosis. A supracervical hysterectomy and left salpingo-oophorectomy are performed without incident. Later that day, the patient’s vitals are stable: temperature 36.8°C (98.2°F), heart rate 98/min, respiratory rate 15/min, blood pressure 100/75 mm Hg, breathing 100% oxygen on room air. The patient is not in acute distress with a Foley catheter in place. The physical exam is unremarkable. However, she has only excreted a minimal amount of urine output in the past several hours after surgery. Only 10cc or urine is produced over the next 12 hours. A bladder scan shows minimal residual urine. CBC, CMP, and urinalysis are ordered, and renal ultrasound is shown in the picture. What are the likely cause of this patient’s anuria and ultrasound finding?	A. Heart failure secondary to overly aggressive fluid resuscitation | B. Iatrogenic injury near the suspensory ligaments | C. Prerenal azotemia secondary to excessive hemorrhage | D. Acute tubular necrosis secondary to hypovolemia | E. Cervical cancer	B	Iatrogenic injury near the suspensory ligaments	GYNECOLOGY	step2
A 45-year-old G2P2 presents with episodes of urgency accompanied by an involuntary passage of urine. These symptoms take place during the day and night. The symptoms are not linked with physical exertion, laughing, or coughing. Her occupation does not involve weight lifting, but she says that sometimes it is very stressful for her. She denies any other genitourinary symptoms. She had  1 vaginal delivery and 1 cesarean section. She does not have a history of genitourinary or neurologic disorders. The weight is 91 kg (200.6 lb) and the height is 172 cm (5 ft 60 in). The vital signs are as follows: blood pressure, 128/75 mmHg; heart rate, 77/min; respiratory rate, 13/min; and temperature, 36.6℃ (97.9℉). The physical examination shows no abdominal masses and no costovertebral angle or suprapubic tenderness. On gynecologic examination, there are no vulvar lesions. The external urethral orifice appears normal. A Q-tip test is negative. The cervix is normally positioned, non-tender, movable, and without visible lesions. The uterus is not enlarged and the ovaries are not palpable. A urinalysis, urine culture, and ultrasound examination of the bladder were all normal. Cystometric studies show the following findings:\n  Measured value Normal range\nResidual volume 10 ml < 50 ml\nSensation-of-fullness volume 190 ml 200–225 ml\nUrge-to-void volume 700 ml 400–500 ml\nInvoluntary contractions present absent\nWhich of the following treatment strategies would be most appropriate for this patient?	A. Instillation of the urethral mesh sling | B. Topical estrogen therapy | C. Augmentation cystoplasty | D. Sacral nerve stimulation | E. Start her on a muscarinic antagonist	E	Start her on a muscarinic antagonist	GYNECOLOGY	step2
A 24-year-old woman presents to the emergency department for evaluation of lower abdominal pain. She endorses 6 hours of progressively worsening pain. She denies any significant past medical history and her physical examination is positive for non-specific, diffuse pelvic discomfort. She denies the possibility of pregnancy given her consistent use of condoms with her partner. The vital signs are: blood pressure, 111/68 mm Hg; pulse, 71/min; and respiratory rate, 15/min. She is afebrile. Which of the following is the next best step in her management?	A. Obtain a pelvic ultrasound | B. Surgical consultation | C. Abdominal CT scan | D. Serum hCG | E. Admission and observation	D	Serum hCG	GYNECOLOGY	step2
