question	options_formatted	correct_letter	answer	category	meta_info
A 65-year-old woman presents to her family doctor to reestablish care since her retirement from her corporate job and loss of her employer-sponsored health insurance. She states that she has not had time for regular check-ups. She exercises 3-4 times a week and consumes red meat sparingly. She drank and smoked cigarettes socially with coworkers but never at home or on vacation. She wakes up with achy wrists and elbows that she suspects is from years of using a computer keyboard. She completed menopause at age 52. Her family history is notable for coronary artery disease on her father's side and colon cancer on her mother's side. She last had a colonoscopy 5 years ago that revealed no abnormal findings. Her vital signs are within normal limits and her physical exam is grossly unremarkable. What diagnostic test should this patient receive?	A. Chest radiograph | B. Colonoscopy | C. Mammography | D. Pelvic ultrasound | E. Vitamin D level	C	Mammography	GYNECOLOGY	step2
A 44-year-old woman is being treated by her oncologist for metastatic breast cancer. The patient had noticed severe weight loss and a fixed breast mass over the past 8 months but refused to see a physician until her husband brought her in. Surgery is scheduled, and the patient is given an initial dose of radiation therapy to destroy malignant cells. Which of the following therapies was administered to this patient?	A. Adjuvant therapy | B. Consolidation therapy | C. Induction therapy | D. Maintenance therapy | E. Salvage therapy	C	Induction therapy	GYNECOLOGY	step2
A 16-year-old female presents to the physician for delayed onset of menstruation. She reports that all of her friends have experienced their first menses, and she wonders whether “something is wrong with me.” The patient is a sophomore in high school and doing well in school. Her past medical history is significant for an episode of streptococcal pharyngitis six months ago, for which she was treated with oral amoxicillin. The patient is in the 35th percentile for weight and 5th percentile for height. On physical exam, her temperature is 98.7°F (37.1°C), blood pressure is 112/67 mmHg, pulse is 71/min, and respirations are 12/min. The patient has a short neck and wide torso. She has Tanner stage I beast development and pubic hair with normal external female genitalia. On bimanual exam, the vagina is of normal length and the cervix is palpable.\n\nWhich of the following is the most accurate test to diagnose this condition?	A. Buccal smear for Barr bodies | B. Karyotype analysis | C. Serum FSH and LH levels | D. Serum testosterone level | E. Serum 17-hydroxyprogesterone level	B	Karyotype analysis	GYNECOLOGY	step2
A 6-year-old girl is brought to the pediatrician by her father for an annual physical examination. The father reports that the patient is a happy and healthy child, but he sometimes worries about her weight. He says that she is a “picky” eater and only wants chicken nuggets and French fries. He also notes some mild acne on her cheeks and forehead but thinks it’s because she “doesn’t like baths.” The father says she has met all her pediatric milestones. She has recently started kindergarten, can tell time, and is beginning to read. Her teacher says she gets along with her classmates well. The patient was born at 38 weeks gestation. She has no chronic medical conditions and takes only a multivitamin. Height and weight are above the 95th percentile. Physical examination reveals scattered comedones on the patient’s forehead and bilateral cheeks. There is palpable breast tissue bilaterally with raised and enlarged areolae. Scant axillary hair and coarse pubic hair are also noted. A radiograph of the left hand shows a bone age of 9 years. Serum follicular stimulating hormone (FSH) level is 9.6 mU/mL (normal range 0.7-5.3 mU/mL) and luteinizing hormone (LH) level is 6.4 mU/mL (normal range < 0.26 mU/mL). Which of the following is the most appropriate diagnostic test?	A. 17-hydroxyprogesterone levels | B. Dehydroepiandrosterone sulfate levels | C. Estrogen levels | D. Head computed tomography (CT) | E. Pelvic ultrasound	D	Head computed tomography (CT)	GYNECOLOGY	step2
A 5-day-old newborn is brought into the pediatrician by her parents for new-onset vaginal bleeding. This morning, when the patient’s father was changing her diaper he noticed blood and white vaginal discharge. The patient was born at 39 weeks to a G1P1 mother who has well-controlled type 1 diabetes. The pregnancy and the vaginal delivery were unremarkable. Apgar scores were 8/9. The mother is breast-feeding and reports that the patient is feeding well. The patient’s temperature is 99°F (37.2°C), blood pressure is 70/48 mmHg, pulse is 134/min, and respirations are 38/min with an oxygen saturation of 98% on room air. She has lost 5% of her weight since birth. Physical examination notes neonatal acne, enlarged breasts, swollen labia, white vaginal discharge, and evidence of blood in the vaginal opening. Which of the following is the most likely cause of the patient’s symptoms?	A. Congenital adrenal hyperplasia | B. External trauma | C. Genitourinary infection | D. Maternal estrogen withdrawal | E. Yolk sac tumor	D	Maternal estrogen withdrawal	GYNECOLOGY	step2
A 49-year-old woman presents to her primary care physician for a routine health maintenance examination. She says that she is currently feeling well and has not noticed any acute changes in her health. She exercises 3 times a week and has tried to increase the amount of fruits and vegetables in her diet. She has smoked approximately 1 pack of cigarettes every 2 days for the last 20 years. Her last pap smear was performed 2 years ago, which was unremarkable. Her past medical history includes hypertension and type II diabetes. Her mother was diagnosed with breast cancer at 62 years of age. The patient is 5 ft 5 in (165.1 cm), weighs 185 lbs (84 kg), and has a BMI of 30.8 kg/m^2. Her blood pressure is 155/98 mmHg, pulse is 90/min, and respirations are 18/min. Physical examination is unremarkable. Lipid studies demonstrate an LDL cholesterol of 130 mg/dL and an HDL cholesterol of 42 mg/dL. Which of the following is the best next step in management?	A. Chest radiography | B. Colonoscopy | C. Mammogram | D. Pap smear | E. Statin therapy	E	Statin therapy	GYNECOLOGY	step2
A 54-year-old woman presents to her primary care physician complaining of a lump in her right breast. She first noticed it 1 month ago. Now she is worried that it may have grown. She claims that the lump is not painful or itchy, and she denies any abnormal nipple bleeding or discharge. She has a family history of breast cancer, including both her mother and older sister. Physical examination reveals a firm, immobile lump in the upper right breast. A mammogram is performed, which identifies an irregular mass with a fibrotically stranded border. A biopsy is performed that is positive for invasive ductal carcinoma. The patient is started on radiation induction therapy and scheduled for a modified radical mastectomy. Following tumor gene testing, the patient is found to be positive or the HER-2/neu oncogene. Which of the following should be started post-mastectomy to improve the patient’s prognosis?	A. Anastrozole | B. Corticosteroids | C. Leuprolide | D. Tamoxifen | E. Trastuzumab	E	Trastuzumab	GYNECOLOGY	step2
The medical student on the pediatric cardiology team is examining a 9-year-old girl who was referred by her primary care physician for unexplained hypertension. She is accompanied by her mother who reveals that the child is generally well but has been significantly less active than her peers for the past year. On exam, the medical student notes a thin girl in no apparent distress appearing slightly younger than stated age. Vital signs reveal a BP is 160/80, HR 80, RR 16. Physical exam is notable only for a clicking sound is noted around the time of systole but otherwise the cardiac exam is normal. Pedal pulses could not be palpated. Which of the following physical exam findings was most likely missed by both the medical student and primary care physician?	A. Cleft palate | B. Prominent occiput | C. Long philtrum | D. Webbed neck | E. Single palmar crease	D	Webbed neck	GYNECOLOGY	step2
A 42-year-old G3P3003 presents for a 6-week postpartum obstetric visit and complains of left breast redness, swelling, and pain. The patient has been breastfeeding since her recent spontaneous vaginal delivery, and after her symptoms began 4 weeks ago, she was treated with oral dicloxacillin without resolution of symptoms. She denies fevers or chills and has no past medical history or family history. Prior to becoming pregnant, the patient smoked one pack per day; she now smokes cigarettes only when stressed. Her infant is healthy and developing well. Temperature is 98.9°F (37.2°C), blood pressure is 114/78 mmHg, pulse is 86/min, and respirations are 14/min. On exam, the right breast appears normal while the left breast is shown in Figure A. There is no discrete palpable mass or axillary lymphadenopathy on either side, and no lymphadenopathy is present in the cervical or inguinal chains either. Which of the following is the most likely etiology of this patient’s presentation?	A. Fungal infection | B. Bacterial infection | C. Smoking | D. Adenocarcinoma | E. Lymphoma	D	Adenocarcinoma	GYNECOLOGY	step2
A 28-year-old gravida 1 para 1 woman is being seen in the hospital for breast tenderness. She reports that both breasts are swollen and tender. She is also having difficulty getting her newborn to latch. The patient gave birth 4 days ago by uncomplicated vaginal delivery. During her pregnancy, the patient developed gestational diabetes but was otherwise healthy. She took folate and insulin. She attended all her pre-natal appointments. Upon examination, the patient has a low grade fever, but all other vital signs are stable. Bilateral breasts appear engorged and are tender to palpation. There is no erythema, warmth, or induration. A lactation nurse is brought in to assist the patient and her newborn with more effective breastfeeding positions. The patient says a neighbor told her that breastmilk actually lacks in nutrients, and she asks what the best option is for the health of her newborn. Which of the following components is breastmilk a poor source of?	A. Immunoglobulin A | B. Lysozymes | C. Phosphorus | D. Vitamin D | E. Whey protein	D	Vitamin D	OBSTETRICS	step2
A 23-year-old woman presents to the emergency department for vomiting and abdominal pain. The patient states that she has been unable to eat or drink for the past 24 hours without vomiting. She also complains of worsening abdominal pain that started 3 days ago. The patient has a past medical history of IV drug abuse and alcohol abuse. She is not on any current medications. Her temperature is 99.5°F (37.5°C), blood pressure is 127/68 mmHg, pulse is 120/min, respirations are 17/min, and oxygen saturation is 98% on room air. On physical exam, tenderness is elicited when the right lower quadrant of her abdomen is palpated. Deep palpation and release of the left lower quadrant of her abdomen also causes severe pain. Rectal exam reveals normal tone and stool is Guiac negative. Laboratory studies are ordered as seen below.\n\nHemoglobin: 12 g/dL\nHematocrit: 36%\nLeukocyte count: 11,500/mm^3 with normal differential\nPlatelet count: 197,000/mm^3\n\nSerum:\nNa+: 139 mEq/L\nCl-: 100 mEq/L\nK+: 4.3 mEq/L\nHCO3-: 27 mEq/L\nBUN: 20 mg/dL\nGlucose: 67 mg/dL\nCreatinine: 1.1 mg/dL\nCa2+: 10.2 mg/dL\nAST: 12 U/L\nALT: 15 U/L\n\nUrine:\nCocaine: positive\nAmphetamines: positive\nß-hCG: positive\nMarijuana: positive\nHeroin: negative\nPCP: negative\nMDMA: positive\nGlucose: negative\nKetones: negative\n\nWhich of the following is the next best step in management?	A. Chest radiograph | B. Abdominal CT | C. Abdominal MRI | D. Ultrasound | E. Colonoscopy	D	Ultrasound	OBSTETRICS	step2
A 25-year-old woman presents to the emergency department with intermittent uterine contractions. She is 39 weeks pregnant and experienced a deluge of fluid between her legs while she was grocery shopping. She now complains of painful contractions. She is transferred to the labor and delivery floor and a healthy male baby is delivered. He has a ruddy complexion and is crying audibly. Laboratory values demonstrate a hemoglobin of 22 g/dL and electrolytes that are within normal limits. Which of the following is the best description for the cause of this neonate's presentation?	A. Dehydration | B. Healthy infant | C. Maternal hyperglycemia during the pregnancy | D. Post-term infant | E. Renal abnormality	C	Maternal hyperglycemia during the pregnancy	OBSTETRICS	step2
A 38-year-old G4P3 presents to her obstetrician’s office for her 20-week anatomy ultrasound. She reports that she feels well and has not experienced any contractions or vaginal bleeding. She also reports good fetal movement. The patient declined prenatal screening earlier in the pregnancy for religious reasons but would now like an anatomy ultrasound to ensure the fetus is growing appropriately. The patient’s previous pregnancies were uncomplicated, and she delivered three healthy babies at full term. On the ultrasound, the technician observes a male fetus with likely intrauterine growth restriction (IUGR). She also notes microcephaly, convex-rounded feet, and clenched fists with overlapping fingers. The technician further notes a medium-sized ventricular septal defect (VSD). The amniotic fluid index (AFI) is 26 cm.\n\nWhich of the following additional findings is most likely to be observed in this fetus?	A. Cleft palate | B. Epicanthal folds | C. Micropthlamia | D. Prominent occiput | E. Webbed neck	D	Prominent occiput	OBSTETRICS	step2
"A 55-year-old gentleman presents to the ED complaining of acute onset of pain ""tearing"" through his chest and back. A chest radiograph is obtained (Figure A). What of the following specific symptoms is most likely to be seen in this patient?"	A. Systolic murmur | B. Wide variations in pulse or BP between the right and left arms | C. Wide variations in pulse or BP between the upper and lower extremities | D. Exertional chest pain relieved by nitrates | E. Pain radiating to the left arm, jaw, neck, and shoulder	B	Wide variations in pulse or BP between the right and left arms	OBSTETRICS	step2
A 9-year-old boy with a history of acute lymphoblastic leukemia is brought to the clinic by his mother because of pruritic vesicles that appeared on the left side of his torso 12 hours ago. One day earlier, before the appearance of the vesicles, the patient’s mother notes that he had been complaining of a burning sensation in that area. The boy has been receiving chemotherapy consisting of methotrexate, cytarabine, and cyclophosphamide for 1 month. He received the last treatment 2 days ago. He has no other past medical history. The patient is afebrile and vital signs are within normal limits. Upon physical examination, there are painful vesicles are localized to the left C7 skin dermatome (see image). Which of the following is the most likely etiology of the skin lesions in this patient?	A. Viral infection of the skin | B. Reactivation of the varicella zoster virus (VZV) due to congenital immunodeficiency | C. Chickenpox | D. Reactivation of VZV due to immunodeficiency caused by chemotherapy | E. Bacterial infection of the skin	D	Reactivation of VZV due to immunodeficiency caused by chemotherapy	OBSTETRICS	step1
A 25-year-old G1P0 woman at an estimated gestational age of 9 weeks presents for her first prenatal visit following a positive home pregnancy test. She says she missed 2 periods but assumed it was due to stress at work. She has decided to continue with the pregnancy. Her past medical history is significant for migraine headaches, seizures, and asthma. She takes multiple medications for her condition. Physical examination is unremarkable. An ultrasound confirms a 9-week-old intrauterine pregnancy. Which of these following medications poses the greatest risk to the fetus?	A. Acetaminophen | B. Sumatriptan | C. Valproic acid | D. Albuterol | E. Budesonide	C	Valproic acid	OBSTETRICS	step1
A 38-year-old woman presents to the emergency department with painless vaginal bleeding of sudden onset approx. 1 hour ago. The woman informs the doctor that, currently, she is in the 13th week of pregnancy. She also mentions that she was diagnosed with hyperemesis gravidarum during the 6th week of pregnancy. On physical examination, her temperature is 37.2°C (99.0°F), pulse rate is 110/min, blood pressure is 108/76 mm Hg, and respiratory rate is 20/min. A general examination reveals pallor. Examination of the abdomen suggests that the enlargement of the uterus is greater than expected at 13 weeks of gestation. An ultrasonogram shows the absence of a fetus and the presence of an intrauterine mass with multiple cystic spaces that resembles a bunch of grapes. The patient is admitted to the hospital and her uterine contents are surgically removed. The atypical tissue is sent for genetic analysis, which of the following karyotypes is most likely to be found?	A. 46, XX | B. 46, XY | C. 46, YY | D. 69, XXX | E. 69, XXY	A	46, XX	OBSTETRICS	step1
A 21-year-old primigravida woman visits the clinic in her 22nd week of gestation as part of her antenatal care. She has no complaints. Past medical history is unremarkable. Her only medication is a prenatal vitamin. Her temperature is 37.0°C (98.6°F), blood pressure is 110/70 mm Hg, pulse rate is 78/min, and respiration rate is 20/min. Physical examination is consistent with the gestational age of her pregnancy with no abnormalities noted. Urine dipstick is normal. Which of the following is the current primary location for fetal myelopoiesis at this stage of development?	A. Yolk sac | B. Liver | C. Thymus | D. Aorta-gonad-mesonephros region | E. Spleen	B	Liver	OBSTETRICS	step1
A 40-year-old woman in her 18th week of pregnancy based on the last menstrual period (LMP) presents to her obstetrician for an antenatal check-up.\nThe antenatal testing is normal, except the quadruple screen results which are given below:\nMaternal serum alpha-fetoprotein (MS-AFP) low\nUnconjugated estriol low\nHuman chorionic gonadotropin (hCG) high\nInhibin-A high\nWhich of the following conditions is the most likely the cause of the abnormal quadruple screen?	A. Trisomy 21 | B. Spina bifida | C. Omphalocele | D. Gastroschisis | E. Fetal alcohol syndrome	A	Trisomy 21	OBSTETRICS	step1
A 34-year-old woman visits an outpatient clinic with a complaint of pain in her left breast for the last few months. The pain worsens during her menstrual cycle and relieves once the cycle is over. She denies any nipple discharge, skins changes, warmth, erythema, or a palpable mass in the breast. Her family history is negative for breast, endometrial, and ovarian cancer. There is no palpable mass or any abnormality in the physical examination of her breast. A mammogram is ordered which shows a cluster of microcalcifications with a radiolucent center. A breast biopsy is also performed which reveals a lobulocentric proliferation of epithelium and myoepithelium. Which of the following is the most likely diagnosis?	A. Intraductal papilloma | B. Fibroadenoma | C. Infiltrating ductal carcinoma | D. Sclerosing adenosis | E. Ductal hyperplasia without atypia	D	Sclerosing adenosis	GYNECOLOGY	step1
A 32-year-old G1P0 woman undergoes her 2nd-trimester ultrasound in a community hospital. During her prenatal care, she was found to have mild anemia, low levels of folate, and serum alpha-fetoprotein levels greater than 2 multiples of the median (MoM) on 2 separate occasions. Her 1st-trimester ultrasound was significant for the absence of the intracranial lucency, no visualization of the cisterna magna, and posterior shift of the brain stem. These 2nd-trimester ultrasound reports reveal the widening of the lumbosacral spine ossification centers and the presence of a sac in proximity to the lumbosacral defect. Which of the following statements best describes the congenital defect in the fetus?	A. Abnormal development of the caudal eminence | B. Persistence of the anterior accessory neurenteric canal (ANC) | C. Failure of the rostral neuropore to close | D. Failure of the caudal neuropore to close | E. Failure of mesenchymal cells to form a neural rod	D	Failure of the caudal neuropore to close	OBSTETRICS	step1
A 35-year-old woman visits the office with complaints of yellowish vaginal discharge and increased urinary frequency for a week. She also complains of pain during urination. Past medical history is irrelevant. She admits to having multiple sexual partners in the past few months. Physical examination is within normal limits except for lower abdominal tenderness. Urine culture yields Chlamydiae trichomatis. What is the most appropriate next step in the management of this patient?	A. Acyclovir | B. Doxycycline | C. Boric acid | D. Clindamycin | E. Metronidazole	B	Doxycycline	REPRODUCTIVE_HEALTH	step1
A 44-year-old woman presents for her annual physical checkup. She says she first noticed a mass in her right breast while taking a shower 3 months ago, which has progressively increased in size. She denies any weight loss, fever, night sweats, discharge from or change in her nipples. Her family history is negative for breast, ovarian, and endometrial cancer. She is afebrile, and her vital signs are within normal limits. Physical examination reveals a smooth, multinodular, firm 5 cm x 5 cm mass in the right breast that is mobile and painless. The skin over the mass appears to be stretched and shiny without ulcerations, erythema, or vascular demarcation. On follow-up 6 weeks later, an interval ultrasound of the right breast reveals a well-circumscribed hypoechoic mass with some cystic components that now measures 8 cm x 7 cm. A core needle biopsy of the mass is performed. Which of the following diagnosis is most likely expected to be confirmed by the core needle biopsy in this patient?	A. Fibroadenoma | B. Breast abscess | C. Phyllodes tumor | D. Duct ectasia | E. Fat necrosis	C	Phyllodes tumor	GYNECOLOGY	step1
A 24-year-old married woman presents to the emergency department with severe abdominal pain since last night. She also complains of scant vaginal bleeding. She says she visited a physician last year who said she had a pelvic infection, but she was never treated because of insurance issues. She also says her period has been delayed this month. She is afebrile. The pulse is 124/min and the blood pressure is 100/70 mm Hg. On examination, her abdomen is distended and tender. A pregnancy test was positive. A complication of infection with which of the following organisms most likely led to this patient’s condition?	A. Candida albicans | B. Neisseria gonorrhoeae | C. Chlamydia trachomatis | D. Mycoplasma genitalium | E. Haemophilus influenzae	C	Chlamydia trachomatis	OBSTETRICS	step1
The menses are 4 weeks overdue in a 23-year-old sexually active woman, thus she is scheduled for an ultrasound examination. The result is shown in the exhibit. What is the function of the structure marked with the green arrow?	A. Removal of nitrogenous waste | B. Embryonic hematopoiesis | C. Production of amniotic fluid | D. Production of progesterone | E. Gas exchange	B	Embryonic hematopoiesis	OBSTETRICS	step1
A 30-year-old woman presents to the office with complaints of pain in her right breast for 5 days. The pain is moderate-to-intense and is localized to the upper quadrant of the right breast, and mainly to the areola for the past 48 hours. She adds that there is some nipple discharge on the same side and that the right breast is red. She was diagnosed with type 1 diabetes at the age of 10 years of age, for which she takes insulin. The family history is negative for breast and ovarian cancers, and endometrial disorders. She smokes one-half pack of cigarettes every day and binge drinks alcohol on the weekends. Two weeks ago she was hit by a volleyball while playing at the beach. There is no history of fractures or surgical procedures. The physical examination reveals a swollen, erythematous, and warm right breast with periareolar tenderness and nipple discharge. There are no palpable masses or lymphadenopathy. Which of the following is the most important risk factor for the development of this patient’s condition?	A. Age | B. Trauma | C. Smoking | D. Diabetes | E. Parity	C	Smoking	GYNECOLOGY	step1
An 18-year-old woman makes an appointment with a gynecologist for her first gynecologic examination. She did not disclose her past medical history, but her sexual debut occurred with her boyfriend 3 weeks ago. She is now complaining of a yellow-green, diffuse, malodorous vaginal discharge that she noticed 1 week ago for the first time. She also reported mild pelvic and abdominal pain. cervical motion tenderness was noted during the pelvic examination. The gynecologist also noticed a pink and inflamed nulliparous cervix with a preponderance of small red punctate spots. There was a frothy white discharge with a malodorous odor in the vaginal vault. A wet mount was prepared for a light microscopic examination, which revealed numerous squamous cells and motile organisms. The gynecologist concluded that this was a sexually-transmitted infection. What is the causative organism?	A. Chlamydia trachomatis | B. Neisseria gonorrhoeae | C. Ureaplasma urealyticum | D. Trichomonas vaginalis | E. Enterobius vermicularis	D	Trichomonas vaginalis	GYNECOLOGY	step1
