question	options_formatted	correct_letter	answer	category	meta_info
A 24-year-old primigravid woman at 38 weeks' gestation comes to the physician for a prenatal visit. At the last two prenatal visits, transabdominal ultrasound showed the fetus in breech presentation. She has no medical conditions and only takes prenatal vitamins. Her pulse is 95/min, respirations are 16/min, and blood pressure is 130/76 mm Hg. The abdomen is soft and nontender; no contractions are felt. Pelvic examination shows a closed cervical os and a uterus consistent with 38 weeks' gestation. The fetal rate tracing shows a baseline heart rate of 152/min and 2 accelerations over 10 minutes. Repeat ultrasound today shows a persistent breech presentation. The patient states that she would like to attempt a vaginal delivery. Which of the following is the most appropriate next step in management?	A. Recommend cesarean section | B. Observe until spontaneous labor | C. Repeat ultrasound in one week | D. Offer external cephalic version | E. Offer internal podalic version	D	Offer external cephalic version	OBSTETRICS	step2
A 26-year-old primigravid woman at 10 weeks' gestation comes to the physician for a prenatal visit. Pregnancy was confirmed by an ultrasound 3 weeks earlier after the patient presented with severe nausea and vomiting. The nausea and vomiting have subsided without medication. She has no vaginal bleeding or discharge. Vital signs are within normal limits. Pelvic examination shows a uterus consistent in size with a 10-week gestation. Transvaginal ultrasonography shows a gestational sac with a mean diameter of 23 mm and an embryo 6 mm in length with absent cardiac activity. Which of the following is the most appropriate next step in management?	A. Serial β-HCG measurements | B. Misoprostol therapy | C. Oxytocin infusion | D. Cervical cerclage | E. Thrombophilia work-up | F. Methotrexate therapy | G. Levonorgestrel therapy	B	Misoprostol therapy	OBSTETRICS	step2
A 26-year-old primigravid woman at 39 weeks' gestation is admitted to the hospital in active labor. Pregnancy was complicated by mild oligohydramnios detected a week ago, which was managed with hydration. Her pulse is 92/min, respirations are 18/min, and blood pressure is 134/76 mm Hg. Pelvic examination shows 100% cervical effacement and 10 cm cervical dilation; the vertex is at 0 station. Cardiotocography is shown. Which of the following is the most appropriate next step in management?	A. Elective cesarean section | B. Emergent cesarean section | C. Reassurance | D. Maternal repositioning and oxygen administration | E. Administration of tocolytics | F. Elevation of the fetal head | G. Rapid amnioinfusion	D	Maternal repositioning and oxygen administration	OBSTETRICS	step2
Five minutes after initiating a change of position and oxygen inhalation, the oxytocin infusion is discontinued. A repeat CTG that is done 10 minutes later shows recurrent variable decelerations and a total of 3 uterine contractions in 10 minutes. Which of the following is the most appropriate next step in management?	A. Administer terbutaline | B. Monitor without intervention | C. Amnioinfusion | D. Emergent Cesarean section | E. Restart oxytocin infusion	C	Amnioinfusion	OBSTETRICS	step2
A 55-year-old woman comes to the physician 10 days after noticing a mass in her left breast while bathing. She is concerned that it is breast cancer because her sister was diagnosed with breast cancer 3 years ago at 61 years of age. Menopause occurred 6 months ago. She has smoked 2 packs of cigarettes daily for 30 years. She took an oral contraceptive for 20 years. Current medications include hormone replacement therapy and a calcium supplement. Examination shows a 2.5-cm, palpable, hard, nontender, mass in the upper outer quadrant of the left breast; there is tethering of the skin over the lump. Examination of the right breast and axillae shows no abnormalities. Mammography shows an irregular mass with microcalcifications and oil cysts. A core biopsy shows foam cells and multinucleated giant cells. Which of the following is the most appropriate next step in management?	"A. Neoadjuvant chemotherapy | B. Trastuzumab for 1 year | C. Reassurance | D. Lumpectomy with axillary staging | E. Anastrozole for 5 years | F. Tamoxifen for 5 years | G. Modified radical mastectomy | H. Wide excision of the lump | I. Simple mastectomy\n"""	C	Reassurance	GYNECOLOGY	step2
"An otherwise healthy 28-year-old primigravid woman at 30 weeks' gestation comes to the physician with a 5-day history of epigastric pain and nausea that is worse at night. Two years ago, she was diagnosed with a peptic ulcer and was treated with a proton pump inhibitor and antibiotics. Medications include folic acid and a multivitamin. Her pulse is 90/min and blood pressure is 130/85 mm Hg. Pelvic examination shows a uterus consistent in size with a 30-week gestation. Laboratory studies show:\nHemoglobin 8.6 g/dL\nPlatelet count 95,000/mm3\nSerum\nTotal bilirubin 1.5 mg/dL\nAspartate aminotransferase 80 U/L\nLactate dehydrogenase 705 U/L\nUrine\npH 6.2\nProtein 2+\nWBC negative\nBacteria occasional\nNitrates negative\nWhich of the following best explains this patient's symptoms?"""	A. Inflammation of the gall bladder | B. Bacterial infection of the kidney | C. Inflammation of the lower esophageal mucosa | D. Stretching of Glisson capsule | E. Acute inflammation of the pancreas | F. Break in gastric mucosal continuity	D	Stretching of Glisson capsule	OBSTETRICS	step2
A 28-year-old woman, gravida 2, para 1, at 14 weeks' gestation, comes to the physician with a 3-day history of abnormal vaginal discharge. She has not had fever, chills, or abdominal pain. One week ago, her 2-year-old daughter had a urinary tract infection that quickly resolved after antibiotic therapy. The patient reports that she is sexually active with one male partner and they do not use condoms. Vital signs are within normal limits. Pelvic examination shows an inflamed and friable cervix. There is mucopurulent, foul-smelling discharge from the cervical os. There is no uterine or cervical motion tenderness. Vaginal pH measurement shows a pH of 3.5. Which of the following is the most appropriate initial step in management?	A. Wet mount preparation | B. Amine test | C. Urine analysis and culture | D. Nucleic acid amplification test | E. Potassium hydroxide preparation	D	Nucleic acid amplification test	OBSTETRICS	step2
An endocervical swab is performed and nucleic acid amplification testing via polymerase chain reaction is conducted. It is positive for Chlamydia trachomatis and negative for Neisseria gonorrhoeae. Which of the following is the most appropriate pharmacotherapy?	A. Oral amoxicillin | B. Intravenous cefoxitin plus oral doxycycline | C. Intramuscular ceftriaxone | D. Oral levofloxacin | E. Intramuscular ceftriaxone plus oral azithromycin | F. Oral azithromycin | G. Oral doxycycline	F	Oral azithromycin	OBSTETRICS	step2
A 42-year-old woman, gravida 3, para 3 comes to the physician because of a 14-month history of prolonged and heavy menstrual bleeding. Menses occur at regular 28-day intervals and last 7 days with heavy flow. She also feels fatigued. She is sexually active with her husband and does not use contraception. Vital signs are within normal limits. Pelvic examination shows a firm, irregularly-shaped uterus consistent in size with a 16-week gestation. Her hemoglobin concentration is 9 g/dL, hematocrit is 30%, and mean corpuscular volume is 92 μm3. Pelvic ultrasound shows multiple intramural masses in an irregularly enlarged uterus. The ovaries appear normal bilaterally. The patient has completed childbearing and would like definitive treatment for her symptoms. Operative treatment is scheduled. Which of the following is the most appropriate next step in management?	A. Progestin-only contraceptive pills | B. Red cell concentrates | C. Danazol | D. Leuprolide | E. Levonorgestrel-releasing intrauterine device | F. Tranexamic acid | G. Methotrexate | H. Estrogen-progestin contraceptive pills	D	Leuprolide	GYNECOLOGY	step2
"A 40-year-old woman presents to her primary care physician with a 5-month history of worsening bladder discomfort. Her discomfort is relieved by voiding. She voids 10–15 times per day and wakes up 2–3 times per night to void. She has not had any involuntary loss of urine. She has tried cutting down on fluids and taking NSAIDs to reduce the discomfort with minimal relief. Her past medical history is significant for bipolar disorder. She is sexually active with her husband but reports that intercourse has recently become painful. Current medications include lithium. Her temperature is 37°C (98.6°F), pulse is 65/min, and blood pressure is 110/80 mm Hg. Examination shows tenderness to palpation of her suprapubic region. Urinalysis shows:\nColor clear\npH 6.7\nSpecific gravity 1.010\nProtein 1+\nGlucose negative\nKetones negative\nBlood negative\nNitrite negative\nLeukocyte esterase negative\nWBC 0/hpf\nSquamous epithelial cells 2/hpf\nBacteria None\nA pelvic ultrasound shows a postvoid residual urine is 25 mL. A cystoscopy shows a normal urethra and normal bladder mucosa. Which of the following is the most likely diagnosis?"""	A. Urinary tract infection | B. Overactive bladder | C. Interstitial cystitis | D. Urinary retention | E. Diabetes insipidus	C	Interstitial cystitis	GYNECOLOGY	step2
A 57-year-old nulliparous woman comes to the physician 2 weeks after noticing a lump in her right breast. Her last mammogram was performed 4 years ago and showed no abnormalities. Menopause began 2 years ago, during which time the patient was prescribed hormone replacement therapy for severe hot flashes and vaginal dryness. Vital signs are within normal limits. Examination of the right breast shows a firm, nontender mass close to the nipple. There are no changes in the skin or nipple, and there is no palpable axillary adenopathy. The abdomen is soft and nontender; there is no organomegaly. Mammography shows a suspicious 2-cm mass adjacent to the nipple. Which of the following is the most appropriate next step in management?	"A. Fine needle aspiration | B. Excisional biopsy | C. Bone scan | D. Measurement of serum CA 15–3 | E. Mastectomy | F. Core needle biopsy\n"""	F	"Core needle biopsy\n"""	GYNECOLOGY	step2
A 24-year-old woman comes to her primary care physician because she has not had a menstrual period for 6 months. She is a competitive runner and has been training heavily for the past year in preparation for upcoming races. She has no family or personal history of serious illness. She has not been sexually active for the past 9 months. Her temperature is 36.9°C (98.4° F), pulse is 51/min, respirations are 12/min, and blood pressure is 106/67 mm Hg. Her BMI is 18.1 kg/m2. Which of the following is the most likely cause of her amenorrhea?	A. Autoimmune destruction of thyroid cells | B. Poor synthetic response of ovarian cells to circulating LH and FSH | C. Increased prolactin secretion | D. Decreased frequency of GnRH release from the hypothalamus | E. Intrauterine adhesions | F. Increased LH release and increased ovarian androgen production	D	Decreased frequency of GnRH release from the hypothalamus	GYNECOLOGY	step2
A 17-year-old girl is brought to the physician by her mother for the evaluation of irregular menstrual bleeding. Menses have occurred at 60- to 90-day intervals since menarche at the age of 12 years. Her last menstrual period was 4 weeks ago. She is sexually active with one male partner, and they use condoms consistently. She reports that she currently has no desire to have children. She is 165 cm (5 ft 5 in) tall and weighs 85 kg (187 lb); BMI is 31 kg/m2. Examination shows scattered pustules on the forehead and oily skin. There is coarse hair on the chin and upper lip. Fingerstick blood glucose concentration is 190 mg/dL. A urine pregnancy test is negative. Which of the following is the most appropriate pharmacotherapy?	A. Letrozole | B. Danazol | C. Leuprolide | D. Clomiphene citrate | E. Metformin | F. Combination oral contraceptives | G. Insulin	F	Combination oral contraceptives	GYNECOLOGY	step2
A 28-year-old primigravid woman at 36 weeks' gestation comes to the emergency department for 2 hours of contractions. Her pregnancy has been uncomplicated. The contractions occur once every 20–30 minutes, last less than 30 seconds, and have been consistent in intensity and duration since onset. During that time there has been an increase in fetal movements. Her temperature is 37.1°C (98.8°F), pulse is 98/min, and blood pressure is 104/76 mm Hg. Pelvic examination shows clear cervical mucus and a firm uterus consistent in size with a 36-week gestation. The cervix is 0% effaced and undilated; the vertex is at -3 station. The fetal heart rate is reassuring. After an hour of monitoring in the emergency department, the character of the contractions and pelvic examination findings remain unchanged. Which of the following is the most appropriate next step?	A. Administer tocolytics | B. Offer local or regional anesthesia | C. Administer oxytocin | D. Admit for continuous monitoring | E. Reassurance and discharge | F. Perform cesarean delivery	E	Reassurance and discharge	OBSTETRICS	step2
A 36-year-old woman comes to the physician to discuss contraceptive options. She is currently sexually active with one male partner, and they have not been using any contraception. She has no significant past medical history and takes no medications. She has smoked one pack of cigarettes daily for 15 years. She is allergic to latex and copper. A urine pregnancy test is negative. Which of the following contraceptive methods is contraindicated in this patient?	A. Progestin injection | B. Diaphragm with spermicide | C. Progestin-only pill | D. Intrauterine device | E. Condoms | F. Combined oral contraceptive pill	F	Combined oral contraceptive pill	REPRODUCTIVE_HEALTH	step2
A previously healthy 30-year-old woman comes to the physician for the evaluation of pain during sexual intercourse for 6 months. She also reports frequent episodes of crampy pelvic pain that starts one day before menses and lasts for 7 days. Her symptoms are not relieved with pain medication. Menses occur at regular 28-day intervals and last 5 days. Her last menstrual period was 2 weeks ago. She is sexually active with her husband. She uses a combined oral contraceptive pill. Her vital signs are within normal limits. Physical examination shows rectovaginal tenderness. Cervical and urethral swabs are negative. Transvaginal ultrasonography shows no abnormalities. Which of the following is the most appropriate next step in management?	A. Measurement of CA-125 levels | B. Hysterectomy | C. Laparoscopy | D. Hysteroscopy | E. CT scan of the abdomen and pelvis	C	Laparoscopy	GYNECOLOGY	step2
A 30-year-old woman, gravida 2, para 1, at 38 weeks' gestation comes to the hospital for regular, painful contractions that have been increasing in frequency. Her pregnancy has been complicated by gestational diabetes treated with insulin. Pelvic examination shows the cervix is 50% effaced and 4 cm dilated; the vertex is at -1 station. Ultrasonography shows no abnormalities. A tocometer and Doppler fetal heart monitor are placed on the patient's abdomen. The fetal heart rate monitoring strip shows a baseline heart rate of 145/min with a variability of ≥ 15/min. Within a 20-minute recording, there are 7 uterine contractions, 4 accelerations, and 3 decelerations that have a nadir occurring within half a minute. The decelerations occur at differing intervals relative to the contractions. Which of the following is the most appropriate next step in the management of this patient?	A. Routine monitoring | B. Vibroacoustic stimulation | C. Amnioinfusion | D. Placement of fetal scalp electrode | E. Emergent cesarean delivery | F. Administer tocolytics	A	Routine monitoring	OBSTETRICS	step2
A 31-year-old woman, gravida 2, para 1, at 32 weeks' gestation comes to the emergency department for sudden leakage of clear vaginal fluid. Her pregnancy has been uncomplicated. Her first child was born at term by vaginal delivery. She has no history of serious illness. She does not drink alcohol or smoke cigarettes. Current medications include vitamin supplements. Her temperature is 37.2°C (98.9°F), pulse is 70/min, respirations are 18/min, and blood pressure is 128/82 mm Hg. Speculum examination demonstrates clear fluid in the cervical canal. The fetal heart rate is reactive at 160/min with no decelerations. Tocometry shows uterine contractions. Nitrazine testing is positive. She is started on indomethacin. Which of the following is the most appropriate next step in management?	A. Administer betamethasone, ampicillin, and proceed with cesarean section | B. Administer ampicillin and perform amnioinfusion | C. Administer ampicillin and test amniotic fluid for fetal lung maturity | D. Administer betamethasone and ampicillin | E. Administer ampicillin and progesterone | F. Administer betamethasone, ampicillin, and proceed with induction of labor	D	Administer betamethasone and ampicillin	OBSTETRICS	step2
A 27-year-old woman, gravida 2, para 1, at 37 weeks' gestation is admitted to the hospital in active labor. She has received routine prenatal care, but she has not been tested for group B streptococcal (GBS) colonization. Pregnancy and delivery of her first child were complicated by an infection with GBS that resulted in sepsis in the newborn. Current medications include folic acid and a multivitamin. Vital signs are within normal limits. The abdomen is nontender and contractions are felt every 4 minutes. There is clear amniotic fluid pooling in the vagina. The fetus is in a cephalic presentation. The fetal heart rate is 140/min. Which of the following is the most appropriate next step in management?	A. Obtain vaginal-rectal swab for nucleic acid amplification testing and GBS culture and intravenous penicillin administration | B. Obtain vaginal-rectal swab for GBS culture and intravenous penicillin administration | C. Reassurance | D. Obtain vaginal-rectal swab for GBS culture | E. Administer intrapartum intravenous penicillin | F. Obtain vaginal-rectal swab for nucleic acid amplification testing and intravenous penicillin administration | G. Obtain vaginal-rectal swab for GBS culture and nucleic acid amplification testing | H. Obtain vaginal-rectal swab for nucleic acid amplification testing | I. Schedule a C-section	E	Administer intrapartum intravenous penicillin	OBSTETRICS	step2
A 29-year-old woman, gravida 1, para 0, at 38 weeks' gestation comes to the emergency department for sudden leakage of clear fluid from her vagina. Her pregnancy has been uncomplicated. She has largely been compliant with her prenatal care but missed some appointments. She has a history of chronic hypertension. She drinks a glass of wine once per week. Current medications include labetalol, iron, and vitamin supplements. Her temperature is 37.9°C (100.2°F), pulse is 70/min, respirations are 18/min, and blood pressure is 128/82 mm Hg. Examination shows a soft and nontender abdomen on palpation. Speculum examination demonstrates clear fluid in the cervical canal. The fetal heart rate is reactive at 170/min with no decelerations. Tocometry shows no contractions. The vaginal fluid demonstrates a ferning pattern when placed onto a glass slide. Which of the following is the most likely cause of this patient's condition?	A. Hypertension | B. Primiparity | C. Ascending infection | D. Sexual intercourse during third trimester | E. β-blocker use | F. Alcohol use | G. Oligohydramnios	C	Ascending infection	OBSTETRICS	step2
A 28-year-old woman comes to the physician because she is unable to conceive for 3 years. She and her partner are sexually active and do not use contraception. They were partially assessed for this complaint 6 months ago. Analysis of her husband's semen has shown normal sperm counts and hormonal assays for both partners were normal. Her menses occur at regular 28-day intervals and last 5 to 6 days. Her last menstrual period was 2 weeks ago. She had a single episode of urinary tract infection 4 years ago and was treated with oral antibiotics. Vaginal examination shows no abnormalities. Bimanual examination shows a normal-sized uterus and no palpable adnexal masses. Rectal examination shows no abnormalities. Which of the following is the most appropriate next step in diagnosis?	A. Psychological counseling only | B. Postcoital testing | C. Hysteroscopy | D. Hysterosalpingogram | E. Chromosomal karyotyping | F. Endometrial biopsy	D	Hysterosalpingogram	REPRODUCTIVE_HEALTH	step2
A 17-year-old girl is brought to the physician because she has not attained menarche. There is no personal or family history of serious illness. She is 168 cm (5 ft 5 in) tall and weighs 63 kg (139 lb); BMI is 22.3 kg/m2. Examination shows normal breast development. Scant axillary hair is present. Abdominal examination shows a firm, nontender left inguinal mass. Pelvic examination shows a blind vaginal pouch. Ultrasonography does not show a uterus or ovaries. Which of the following is the most likely underlying cause of this patient's symptoms?	A. SRY gene defect | B. Mullerian duct agenesis | C. 5-α reductase deficiency | D. Sex chromosome mosaicism | E. Sex chromosome monosomy | F. Androgen insensitivity	F	Androgen insensitivity	GYNECOLOGY	step2
A 28-year-old woman, gravida 1, para 0, at 10 weeks' gestation comes to the physician for her initial prenatal visit. She has no history of serious illness, but reports that she is allergic to penicillin. Vital signs are within normal limits. The lungs are clear to auscultation, and cardiac examination shows no abnormalities. Transvaginal ultrasonography shows an intrauterine pregnancy with no abnormalities. The fetal heart rate is 174/min. Routine prenatal laboratory tests are drawn. Rapid plasma reagin (RPR) test is 1:128 and fluorescent treponemal antibody absorption test (FTA-ABS) is positive. Which of the following is the most appropriate next step in management?	A. Administer oral doxycycline | B. Administer therapeutic dose of intramuscular penicillin G | C. Administer intravenous ceftriaxone | D. Administer penicillin desensitization dose | E. Administer oral azithromycin | F. Reassurance | G. Perform oral penicillin challenge test	D	Administer penicillin desensitization dose	OBSTETRICS	step2
A 24-year-old woman comes to the physician for preconceptional advice. She has been married for 2 years and would like to conceive within the next year. Menses occur at regular 30-day intervals and last 4 days with normal flow. She does not smoke or drink alcohol and follows a balanced diet. She takes no medications. She is 160 cm (5 ft 3 in) tall and weighs 55 kg (121 lb); BMI is 21.5 kg/m2. Physical examination, including pelvic examination, shows no abnormalities. She has adequate knowledge of the fertile days of her menstrual cycle. Which of the following is most appropriate recommendation for this patient at this time?	A. Begin folate supplementation | B. Begin high-dose vitamin A supplementation | C. Begin vitamin B12 supplementation | D. Begin iron supplementation | E. Gain 2 kg prior to conception	A	Begin folate supplementation	REPRODUCTIVE_HEALTH	step2
A 64-year-old woman comes to the physician because of a 4-month history of vulvar itching and dryness. During this period, she has also had pain during sexual intercourse but no postcoital bleeding. Her last menstrual period was at the age of 51 years. She has type 2 diabetes mellitus and her only medication is metformin. Pelvic examination shows atrophic labial folds. There are excoriation marks and a well-demarcated, white plaque on the vulva. The remainder of the examination shows no abnormalities. The results of biopsy rule out cancer. Which of the following is the most appropriate next step in treatment for this patient's lesions?	A. Topical fluconazole | B. Topical clobetasol | C. Topical tacrolimus | D. Topical progesterone | E. Topical estrogen | F. Phototherapy	B	Topical clobetasol	GYNECOLOGY	step2
A 24-year-old woman, gravida 2, para 1, at 10 weeks' gestation comes to the emergency department for vaginal bleeding, cramping lower abdominal pain, and dizziness. She also has had fevers, chills, and foul-smelling vaginal discharge for the past 2 days. She is sexually active with one male partner, and they use condoms inconsistently. Pregnancy and delivery of her first child were uncomplicated. She appears acutely ill. Her temperature is 38.9°C (102°F), pulse is 120/min, respirations are 22/min, and blood pressure is 88/50 mm Hg. Abdominal examination shows moderate tenderness to palpation over the lower quadrants. Pelvic examination shows a tender cervix that is dilated with clots and a solid bloody mass within the cervical canal. Her serum β-human chorionic gonadotropin concentration is 15,000 mIU/mL. Pelvic ultrasound shows an intrauterine gestational sac with absent fetal heart tones. Which of the following is the most appropriate next step in management?	A. Intravenous clindamycin and gentamicin followed by oral misoprostol | B. Oral clindamycin followed by outpatient follow-up in 2 weeks | C. Intravenous clindamycin and gentamicin followed by suction and curettage | D. Intravenous clindamycin and gentamycin followed by close observation | E. Oral clindamycin followed by suction curettage	C	Intravenous clindamycin and gentamicin followed by suction and curettage	OBSTETRICS	step2
