question_clean	answer_rationale
Mention the techniques used to reduce blood loss during myomectomy	Techniques used to reduce blood loss during myomectomy include:    1. _Preoperative GnRH agonists_: To shrink fibroids and reduce bleeding.  2. _Intraoperative vasopressin_: To constrict blood vessels and reduce bleeding.  3. _Tourniquet or rubber band_: To occlude blood flow to the uterus.  4. _Uterine artery ligation_: To reduce blood flow to the uterus.  5. _Temporary clipping of uterine arteries_: To control bleeding.  6. _Electrosurgical coagulation_: To cauterize bleeding vessels.  7. _Suture ligation_: To ligate bleeding vessels.  8. _Hemostatic agents_: To promote clotting and reduce bleeding.  9. _Uterine compression sutures_: To compress the uterus and reduce bleeding.  10. _Intraoperative cell salvage_: To recover and reinfuse blood lost during surgery.  11. _Preoperative autologous blood donation_: To have patient's own blood available for transfusion.  12. _Intraoperative tranexamic acid_: To reduce fibrinolysis and promote clotting.    These techniques can be used alone or in combination to minimize blood loss during myomectomy.
List the suture lines of the fetal skull and their corresponding bordering bones	the suture lines of the fetal skull and their corresponding bordering bones:    1. _Metopic suture_: Frontal bone (interfrontal suture)  2. _Coronal suture_: Frontal bone and parietal bone  3. _Sagittal suture_: Parietal bones (interparietal suture)  4. _Lambdoid suture_: Parietal bone and occipital bone  5. _Occipitomastoid suture_: Occipital bone and mastoid part of temporal bone  6. _Sphenofrontal suture_: Sphenoid bone and frontal bone  7. _Sphenoparietal suture_: Sphenoid bone and parietal bone  8. _Sphenotemporal suture_: Sphenoid bone and temporal bone  9. _Sphenosquamosal suture_: Sphenoid bone and squamous part of temporal bone  10. _Petrosquamosal suture_: Petrous part of temporal bone and squamous part of temporal bone  11. _Intermaxillary suture_: Maxilla bones (intermaxillary suture)  12. _Internasal suture_: Nasal bones (internasal suture)  13. _Nasofrontal suture_: Nasal bone and frontal bone  14. _Zygomaticofrontal suture_: Zygomatic bone and frontal bone  15. _Zygomaticotemporal suture_: Zygomatic bone and temporal bone  16. _Zygomaticomaxillary suture_: Zygomatic bone and maxilla bone  17. _Frontonasal suture_: Frontal bone and nasal bone  18. _Parietomastoid suture_: Parietal bone and mastoid part of temporal bone
What are the causes of primary amenorrhea and the causes of secondary amenorrhea	*Primary Amenorrhea:*    Primary amenorrhea is the absence of menstruation in a woman by the age of 16, or by 14 if there are no secondary sexual characteristics. Causes include:    1. *Genetic disorders*: Turner syndrome, Klinefelter syndrome, and androgen insensitivity syndrome.  2. *Hormonal imbalances*: Hypothalamic or pituitary gland problems, thyroid disorders, or adrenal gland disorders.  3. *Reproductive system abnormalities*: Uterine or vaginal agenesis, imperforate hymen, or cervical stenosis.  4. *Developmental disorders*: Müllerian agenesis or Mayer-Rokitansky-Küster-Hauser syndrome.  5. *Chromosomal abnormalities*: 46,XY gonadal dysgenesis or Swyer syndrome.    *Secondary Amenorrhea:*    Secondary amenorrhea is the absence of menstruation for 3-6 months in a woman who has previously menstruated. Causes include:    1. *Hormonal imbalances*: Polycystic ovary syndrome (PCOS), thyroid disorders, or hyperprolactinemia.  2. *Pregnancy or breastfeeding*: Amenorrhea can occur during pregnancy or breastfeeding.  3. *Weight changes*: Significant weight gain or loss, or eating disorders.  4. *Stress or emotional factors*: Stress, anxiety, or depression.  5. *Medications*: Birth control pills, antidepressants, or antipsychotics.  6. *Reproductive system disorders*: Asherman's syndrome, endometrial scarring, or cervical stenosis.  7. *Pituitary gland problems*: Tumors or inflammation.  8. *Hypothalamic disorders*: Tumors, inflammation, or congenital conditions.  9. *Ovarian failure*: Premature ovarian failure or menopause.  10. *Other medical conditions*: Diabetes, celiac disease, or autoimmune disorders.
What are the protective factors for ovarian cancer for women in Nigeria	Protective factors for ovarian cancer in women in Nigeria include:    1. _Early childbearing_: Women who have their first child before age 25 have a lower risk.  2. _Multiple pregnancies_: Women who have had multiple pregnancies have a lower risk.  3. _Breastfeeding_: Breastfeeding for at least 12 months can reduce the risk.  4. _Tubal ligation_: Women who have had their tubes tied have a lower risk.  5. _Hysterectomy_: Women who have had a hysterectomy have a lower risk.  6. _Oral contraceptive use_: Using oral contraceptives for at least 5 years can reduce the risk.  7. _Healthy diet_: A diet rich in fruits, vegetables, and whole grains may reduce the risk.  8. _Regular exercise_: Regular physical activity may reduce the risk.  9. _Maintaining a healthy weight_: Being overweight or obese increases the risk.  10. _Avoiding talcum powder_: Using talcum powder in the genital area may increase the risk.  11. _Genetic testing and counseling_: Women with a family history of ovarian cancer may benefit from genetic testing and counseling.  12. _Screening_: Regular screening with transvaginal ultrasound and CA-125 blood tests may help detect ovarian cancer early.    It's essential to note that these protective factors may not completely eliminate the risk of ovarian cancer, and women should be aware of the symptoms and seek medical attention if they experience any unusual signs or symptoms.    In Nigeria, cultural and socioeconomic factors may influence the adoption of these protective factors. Therefore, public health initiatives should focus on education, awareness, and access to healthcare services to reduce the burden of ovarian cancer.
What are the unique differences between ovarian and cervical cancer   Which is commoner in Africa	Ovarian and cervical cancer are both gynecological cancers, but they have distinct differences:    *Ovarian Cancer:*    1. *Origin*: Arises from ovarian tissue  2. *Symptoms*: Vague, e.g., bloating, abdominal pain, weight loss  3. *Screening*: No effective screening test available  4. *Treatment*: Surgery, chemotherapy, targeted therapy  5. *Prognosis*: Poor, due to late diagnosis    *Cervical Cancer:*    1. *Origin*: Arises from cervical tissue  2. *Symptoms*: Abnormal bleeding, pelvic pain, discharge  3. *Screening*: Pap smear and HPV test available  4. *Treatment*: Surgery, radiation therapy, chemotherapy  5. *Prognosis*: Better, due to early detection and treatment    In Africa, *cervical cancer* is more common due to:    1. *High prevalence of HPV*  2. *Limited access to screening and vaccination*  3. *Low awareness and education*  4. *Weak healthcare systems*  5. *High incidence of HIV/AIDS* (which increases the risk of cervical cancer)    According to the World Health Organization (WHO), cervical cancer is the second most common cancer in women in Africa, with an estimated 34.8 cases per 100,000 women per year. Ovarian cancer incidence in Africa is lower, with an estimated 4.8 cases per 100,000 women per year.    It's essential to note that both cancers have a significant impact on women's health in Africa, and efforts should be made to improve awareness, screening, and treatment options to reduce the burden of these diseases.
Why is multiple gestation commoner in African women and what are the complications of multiple gestation	Multiple gestation is more common in African women due to various factors, including:    1. _Genetics_: African women are more likely to have a family history of twins, which increases their chances of having multiples.  2. _Hormonal influences_: African women tend to have higher levels of follicle-stimulating hormone (FSH), which can stimulate the release of multiple eggs during ovulation.  3. _Diet and lifestyle_: A diet rich in certain nutrients, such as folic acid and cassava, may increase the likelihood of releasing multiple eggs.  4. _Higher fertility rates_: African women tend to have higher fertility rates, which increases the chances of conceiving multiples.    Complications of multiple gestation include:    1. _Preterm labor and delivery_  2. _Low birth weight and small size_  3. _Gestational diabetes and hypertension_  4. _Preeclampsia and eclampsia_  5. _Placenta previa and abruption_  6. _Fetal growth restriction and discordance_  7. _Birth defects and chromosomal abnormalities_  8. _Cesarean delivery and surgical complications_  9. _Postpartum depression and anxiety_  10. _Increased risk of maternal and fetal mortality_    Additionally, multiple gestation increases the risk of:    1. _Twin-to-twin transfusion syndrome_  2. _Twin anemia-polycythemia sequence_  3. _Selective fetal growth restriction_  4. _Umbilical cord abnormalities_  5. _Placental insufficiency_    It's crucial for women carrying multiples to receive regular prenatal care and monitoring to minimize these risks and ensure a healthy pregnancy and delivery.
What is multiple gestation and what are the risk factors	Multiple gestation, also known as multiple pregnancy, refers to the presence of two or more fetuses in the womb during a single pregnancy. The risk factors for multiple gestation include:    1. *Family history*: Having a family history of twins or multiple births.  2. *Race*: Women of West African descent are more likely to have twins.  3. *Age*: Women over 35 years old, especially those between 40-45 years old.  4. *Fertility treatments*: Assisted reproductive technologies like IVF, IUI, and ovulation induction.  5. *Multiple pregnancies in the past*: Women who have had multiple pregnancies before are more likely to have another multiple gestation.  6. *Body type*: Women who are taller or have a higher body mass index (BMI) are more likely to conceive multiples.  7. *Breastfeeding*: Women who are breastfeeding and become pregnant are more likely to conceive multiples.  8. *Genetics*: Some women may be more likely to conceive multiples due to genetic factors.  9. *Hormonal factors*: Women with polycystic ovary syndrome (PCOS) or other hormonal imbalances may be more likely to conceive multiples.    The risks associated with multiple gestation include:    1. *Preterm labor*  2. *Low birth weight*  3. *Gestational diabetes*  4. *Hypertension*  5. *Preeclampsia*  6. *Placenta previa*  7. *Fetal growth restriction*  8. *Birth defects*  9. *Cesarean delivery*  10. *Postpartum depression*    It's essential for women carrying multiples to receive regular prenatal care and monitoring to minimize these risks.
What are the screening tests and diagnostic methods for cervical intraepithelial neoplasm	The following are screening tests and diagnostic methods for cervical intraepithelial neoplasm (CIN):    Screening Tests:    1. _Pap Smear (Papanicolaou Test)_: A routine test that examines cervical cells for abnormalities.  2. _Human Papillomavirus (HPV) Test_: Detects high-risk HPV types in cervical cells.  3. _Co-testing_: Combination of Pap smear and HPV test.    Diagnostic Methods:    1. _Colposcopy_: A procedure using a colposcope to examine the cervix for abnormalities.  2. _Biopsy_: Removing a cervical tissue sample for examination.  3. _Endocervical Curettage (ECC)_: Scraping the cervical canal to collect tissue samples.  4. _Loop Electrosurgical Excision Procedure (LEEP)_: Removing abnormal cervical tissue using a wire loop.  5. _Cone Biopsy_: Removing a cone-shaped sample of cervical tissue.  6. _Imaging Tests_: Ultrasound, MRI, or CT scans to evaluate cervical lesions.  7. _Histopathology_: Examining tissue samples under a microscope for abnormal cell growth.    It's important to note that these tests and methods are used in combination to diagnose CIN and determine its severity, which helps guide appropriate treatment. Regular screening and early detection can prevent CIN from progressing to cervical cancer.
List the risk factors for cervical intraepithelial neoplasm amongst women in Nigeria	Cervical intraepithelial neoplasm (CIN) is a precancerous lesion that can potentially develop into cervical cancer. Risk factors for CIN amongst women in Nigeria include:    1. *Human Papillomavirus (HPV) infection*: High-risk HPV types 16, 18, 31, 33, and 45.  2. *Early sexual debut*: Engaging in sexual activity at a young age.  3. *Multiple sexual partners*: Having multiple sexual partners increases the risk of HPV infection.  4. *Weakened immune system*: Women with compromised immune systems, such as those living with HIV/AIDS.  5. *Smoking*: Tobacco smoking and exposure to secondhand smoke.  6. *Family history*: Having a first-degree relative (mother, sister, or daughter) with cervical cancer.  7. *Low socioeconomic status*: Limited access to healthcare, education, and screening services.  8. *Lack of cervical screening*: Not undergoing regular Pap smears or HPV tests.  9. *Age*: Women between 25 and 35 years old are at higher risk.  10. *Multiparity*: Having multiple pregnancies.  11. *Long-term use of oral contraceptives*: Using birth control pills for more than 5 years.  12. *Diethylstilbestrol (DES) exposure*: Women whose mothers used DES during pregnancy.  13. *Chlamydia trachomatis infection*: Untreated chlamydia infection.  14. *Vitamin deficiencies*: Low levels of vitamins A, C, and E.  15. *Obesity*: Being overweight or obese.    It's important to note that many of these risk factors are interrelated, and addressing them can help reduce the burden of CIN and cervical cancer in Nigeria.
What are the Limitations of Laparoscopy in Nigeria	Laparoscopy, a minimally invasive surgical technique, has revolutionized healthcare globally. However, in Nigeria, there are limitations to its adoption and utilization. Some of the limitations include:    1. _Limited access to equipment_: High-quality laparoscopic equipment is often scarce or unaffordable in many Nigerian hospitals.    2. _Lack of trained professionals_: Surgeons and gynecologists with specialized training in laparoscopy are limited in number.    3. _Infrastructure challenges_: Inadequate electrical power supply, lack of suction machines, and limited operating room space hinder laparoscopic procedures.    4. _Cost constraints_: Laparoscopic surgery is often more expensive than open surgery, making it inaccessible to many Nigerians.    5. _Limited awareness_: Many patients and healthcare providers are unaware of the benefits and indications of laparoscopy.    6. _Technological limitations_: Limited access to advanced laparoscopic technologies like robotic-assisted surgery and single-incision laparoscopy.    7. _Maintenance and repair challenges_: Difficulty in maintaining and repairing laparoscopic equipment due to lack of technical expertise and spare parts.    8. _Energy crisis_: Frequent power outages can interrupt laparoscopic procedures, compromising patient safety.    9. _Limited availability of laparoscopic consumables_: Difficulty in sourcing high-quality laparoscopic instruments and consumables.    10.     - Cultural and religious beliefs*: Some patients may prefer open surgery due to cultural or religious beliefs.    Addressing these limitations is crucial to increasing access to laparoscopy in Nigeria and improving healthcare outcomes.
Write on the the use of Laparoscopy in morden day medicine	Laparoscopy is a minimally invasive surgical technique that has revolutionized modern medicine. This procedure involves inserting a laparoscope, a thin tube with a camera and light, through small incisions in the abdomen to visualize internal organs and perform surgeries.    The benefits of laparoscopy are numerous:    1. *Less pain*: Smaller incisions result in reduced pain and scarring.  2. *Faster recovery*: Patients can return to their normal activities sooner.  3. *Reduced risk of complications*: Less chance of infection, bleeding, and adhesions.  4. *Improved visualization*: High-definition cameras provide a clear view of internal structures.  5. *Minimally invasive*: Reduced trauma to surrounding tissues and organs.    Laparoscopy is widely used in various medical specialties:    1. *Gynecology*: Ectopic pregnancy treatment, hysterectomy, endometriosis management.  2. *General Surgery*: Appendectomy, cholecystectomy, hernia repair.  3. *Urology*: Prostate surgery, kidney stone removal, bladder cancer treatment.  4. *Oncology*: Cancer staging, tumor resection, biopsy.  5. *Bariatric Surgery*: Weight loss surgery, gastric bypass, sleeve gastrectomy.    Advances in laparoscopy include:    1. *Robotic-assisted laparoscopy*: Enhanced precision and dexterity.  2. *Single-incision laparoscopy*: Reduced scarring and pain.  3. *Natural orifice transluminal endoscopic surgery (NOTES)*: Scarless surgery through natural orifices.    In conclusion, laparoscopy has transformed modern medicine by providing a safer, less invasive, and more effective approach to surgery. Its applications continue to expand, improving patient outcomes and quality of life.
What is the ratio of maternal mortality in various African countries	Maternal Mortality in Africa    Maternal mortality remains a significant public health concern in Africa, where the majority of global maternal deaths occur. The continent faces numerous challenges in reducing maternal mortality, including:    _Risk Factors:_    1. _Limited access to healthcare_: Many women in Africa lack access to quality healthcare services, particularly in rural areas.  2. _Poor healthcare infrastructure_: Inadequate facilities, equipment, and trained healthcare professionals contribute to the high maternal mortality rate.  3. _Hypertension and diabetes_: Prevalence of these conditions is increasing in Africa, leading to complications during pregnancy and childbirth.  4. _Malnutrition and anemia_: Widespread malnutrition and anemia among pregnant women increase the risk of maternal death.  5. _Child marriage and early pregnancy_: Young mothers are more likely to experience complications during pregnancy and childbirth.  6. _HIV/AIDS_: The high prevalence of HIV/AIDS in some African countries increases the risk of maternal mortality.  7. _Cultural beliefs and practices_: In some communities, traditional beliefs and practices may delay or prevent women from seeking medical care during pregnancy and childbirth.    _Country-Specific Estimates:_    1. _Nigeria_: 821 deaths per 100,000 live births  2. _South Africa_: 134 deaths per 100,000 live births  3. _Democratic Republic of the Congo_: 693 deaths per 100,000 live births  4. _Ethiopia_: 401 deaths per 100,000 live births  5. _Kenya_: 342 deaths per 100,000 live births  6. _Tanzania_: 398 deaths per 100,000 live births  7. _Ghana_: 145 deaths per 100,000 live births  8. _Mozambique_: 489 deaths per 100,000 live births  9. _Uganda_: 336 deaths per 100,000 live births  10. _Mali_: 587 deaths per 100,000 live births  11. _Zambia_: 224 deaths per 100,000 live births  12. _Zimbabwe_: 443 deaths per 100,000 live births  13. _Rwanda_: 210 deaths per 100,000 live births  14. _Botswana_: 129 deaths per 100,000 live births  15. _Namibia_: 150 deaths per 100,000 live births
Reasons for obstructed labour amongst Nigerian women	Obstructed labor is a leading cause of maternal and fetal morbidity and mortality in Nigeria. Some reasons for obstructed labor amongst Nigerian women include:    1. cephalopelvic disproportion (CPD): When the baby's head or body is too large to pass through the mother's pelvis.    2. Prolonged labor: Labor that lasts beyond 12 hours can lead to obstruction.    3. Malposition: Abnormal position of the baby, such as a breech presentation.    4. Pelvic abnormalities: Congenital or acquired deformities of the pelvis.    5. Uterine anomalies: Abnormalities in the shape or structure of the uterus.    6. Fibroids: Large fibroids can obstruct the birth canal.    7. Previous uterine surgery or scar: Adhesions or scars from previous surgeries can cause obstruction.    8. High parity: Women who have had multiple births are at higher risk.    9. Age: Teenagers and women over 35 years old are at higher risk.    10. Lack of access to quality healthcare: Delayed or inadequate medical care can contribute to obstructed labor.    11. Cultural beliefs: In some communities, women may avoid medical care due to cultural or traditional beliefs.    12. Nutritional deficiencies: Poor nutrition and micronutrient deficiencies can contribute to obstructed labor.    Addressing these factors through improved access to quality healthcare, education, and nutrition can help reduce the incidence of obstructed labor in Nigerian women.
How has abruption placenta been relatively problematic in pregnant women in Africa	Placental abruption, also known as abruptio placentae, is a serious pregnancy complication where the placenta partially or completely separates from the uterus, depriving the baby of oxygen and nutrients. In African women, placental abruption is a significant concern due to various factors:    1. High prevalence: Placental abruption is more common in African women, especially in sub-Saharan Africa, due to limited access to quality healthcare and high rates of hypertension and diabetes.    2. Maternal mortality: Placental abruption is a leading cause of maternal mortality in Africa, accounting for up to 15% of pregnancy-related deaths.    3. Risk factors: African women are more likely to experience risk factors such as:      - Hypertension      - Diabetes      - Multiple pregnancies      - Advanced maternal age      - History of previous uterine surgery or cesarean section    4. Limited access to care: In many African countries, women may not have access to timely and adequate medical care, leading to delayed diagnosis and treatment.    5. Cultural beliefs: In some African cultures, women may delay seeking medical attention due to traditional beliefs or fear of hospitalization.    6. Nutritional factors: Poor nutrition and micronutrient deficiencies, common in some African regions, may contribute to placental abruption.    7. HIV/AIDS: The high prevalence of HIV/AIDS in some African countries increases the risk of placental abruption.    It is essential to address these factors through:    1. Improving access to quality healthcare  2. Enhancing maternal health education  3. Encouraging early prenatal care  4. Managing hypertension and diabetes  5. Providing nutritional support  6. Addressing cultural beliefs and fears    By tackling these challenges, we can reduce the incidence of placental abruption and improve maternal and fetal outcomes in African women.
Write on the impact of gestational diabetes on African women	Gestational diabetes is a type of diabetes that develops during pregnancy, usually in the second or third trimester. It is caused by hormonal changes and insulin resistance, which can lead to high blood sugar levels.    Risk factors:    - Obesity. Most africans live a sedentary life style and are mostly obesed    - Family history of diabetes,, commonly seen in Africa     - Previous history of gestational diabetes    - Age over 35, African women mostly are seen to get married from the ages of 30 due to financial and traditional beliefs     - Multiple pregnancy,, an average African family wants a home of least 5 children     Symptoms:    - Increased thirst and urination  - Fatigue  - Blurred vision  - Slow healing of cuts and wounds    Complications:    - Macrosomia (large baby)  - Preterm labor  - Cesarean delivery  - Hypoglycemia (low blood sugar) in the baby  - Increased risk of type 2 diabetes after pregnancy    Management:    - Dietary changes (healthy eating)  - Exercise (regular physical activity)  - Blood sugar monitoring  - Insulin therapy (if necessary)    With proper management, most women with gestational diabetes can have a healthy pregnancy and delivery.
Write briefly on pelvic inflammatory disease stating why it is common in African teenagers	Pelvic Inflammatory Disease (PID) is a bacterial infection that affects the female reproductive organs, including the uterus, fallopian tubes, and ovaries. It is often caused by untreated sexually transmitted infections (STIs) like chlamydia and gonorrhea.    Symptoms:    - Lower abdominal pain  - Abnormal vaginal discharge  - Fever  - Painful urination  - Painful sex  - Irregular menstrual bleeding    Complications:    - Infertility  - Ectopic pregnancy  - Chronic pelvic pain  - Abscesses  - Increased risk of HIV transmission    Treatment:    - Antibiotics to clear the infection  - Pain management  - Rest and avoiding strenuous activities  - Avoiding sexual intercourse until treatment is completed  - Partner treatment to prevent re-infection    Early diagnosis and treatment are crucial to prevent long-term complications and infertility. If you suspect PID, consult a healthcare provider promptly.    Reasons why it is common in teenage Africans include   Poverty which in most cases lead teachers to prostitution hence having multiple sexual partners   More reasons include negligence ignorance on the use of barrier contraceptives and safe sex practices
