question_clean	answer_rationale
List the complications of intrauterine contraceptive Devices	Intrauterine Contraceptive Devices (IUCDs) are generally safe and effective, but like any medical device, they can cause complications. Here are some possible complications of IUCDs:\n\n1. _Perforation_: The IUCD can puncture the uterus, which can lead to infection, adhesions, or damage to surrounding organs.\n\n2. _Expulsion_: The IUCD can be pushed out of the uterus, making it ineffective.\n\n3. _Infection_: Bacterial infection, such as pelvic inflammatory disease (PID), can occur.\n\n4. _Bleeding and spotting_: Irregular bleeding, spotting, or heavy menstrual bleeding can occur.\n\n5. _Cramping_: Mild to severe cramps can occur during or after insertion.\n\n6. _Allergic reaction_: Rarely, an allergic reaction to the materials used in the IUCD can occur.\n\n7. _Embedment_: The IUCD can become embedded in the uterine wall, making removal difficult.\n\n8. _Pregnancy complications_: If pregnancy occurs with an IUCD in place, there's a higher risk of ectopic pregnancy, miscarriage, or preterm labor.\n\n9. _Uterine damage_: The IUCD can cause uterine damage, such as adhesions or scarring.\n\n10. _Difficulty removing the IUCD_: The IUCD can be difficult to remove, which may require surgical intervention.\n\n11. _Hormonal side effects_ (for hormonal IUCDs): Mood changes, breast tenderness, acne, or weight gain can occur.\n\n12. _String problems_: The strings attached to the IUCD can cause discomfort, bleeding, or expulsion.\n\n
What are the complications of twin gestation	Twin gestation, also known as twin pregnancy, carries a higher risk of complications compared to singleton pregnancies. Some potential complications include:\n\n1. _Preterm labor_: Twins are often born prematurely, which can lead to respiratory and other health issues.\n2. _Low birth weight_: Twins tend to have lower birth weights, increasing the risk of health problems.\n3. _Preeclampsia_: High blood pressure during pregnancy, which can lead to serious complications.\n4. _Gestational diabetes_: High blood sugar levels during pregnancy, increasing the risk of complications.\n5. _Placental abruption_: Separation of the placenta from the uterus, which can deprive the babies of oxygen and nutrients.\n6. _Fetal growth restriction_: Slow growth of one or both twins, increasing the risk of health problems.\n7. _Twin-to-twin transfusion syndrome (TTTS)_*: Unequal sharing of blood between twins, leading to complications.\n8. _Cord entanglement_*: Twins can become entangled in each other's umbilical cords, potentially causing distress.\n9. _Postpartum hemorrhage_*: Excessive bleeding after delivery, which can be life-threatening.\n10. _Maternal mortality_*: Higher risk of death during pregnancy, childbirth, or postpartum.\n11. _Cesarean delivery_*: Increased likelihood of needing a C-section.\n12. _Breastfeeding challenges_*: Managing breastfeeding for twins can be difficult.\n13. _Emotional stress_*: Caring for twins can be emotionally overwhelming.\n14. _Financial strain_*: Raising twins can be costly.
List the ways in which adhesions are prevented during myomectomy	To prevent adhesions during myomectomy, the following methods are employed:\n\n1. *Good surgical technique*: Meticulous dissection, minimal tissue handling, and precise suturing reduce tissue trauma.\n\n2. *Electrocautery*: Using electrocautery judiciously to minimize tissue damage.\n\n3. *Irrigation*: Continuous irrigation with saline solution to remove debris and prevent tissue drying.\n\n4. *Adhesion barriers*: Applying adhesion barriers like oxidized regenerated cellulose (ORC) or hyaluronic acid to separate tissues.\n\n5. *Microsurgical techniques*: Using microsurgical instruments and magnification to minimize tissue trauma.\n\n6. *Tissue sealing*: Using tissue-sealing devices to reduce bleeding and promote healing.\n\n7. *Intraoperative corticosteroids*: Administering corticosteroids to reduce inflammation.\n\n8. *Postoperative pain management*: Effective pain control to reduce postoperative inflammation.\n\n9. *Early mobilization*: Encouraging early mobilization to prevent tissue stagnation.\n\n10. *Avoiding unnecessary dissection*: Limiting dissection to the essential areas to prevent unnecessary tissue trauma.\n\n11. *Using adhesion-reducing agents*: Applying agents like Interceed or Seprafilm to reduce adhesion formation.\n\n12. *Maintaining normothermia*: Keeping the patient's temperature normal to promote optimal tissue healing
What are the non contraceptive benefits of oral contraceptives	Oral contraceptives (OCs) have several non-contraceptive benefits, including:\n\n1. _Regulation of menstrual cycles_: OCs can help regulate menstrual cycles, reducing the frequency and severity of menstrual cramps, bloating, and mood swings.\n\n2. _Reduction of menstrual bleeding_: OCs can decrease menstrual bleeding, reducing the risk of iron-deficiency anemia.\n\n3. _Relief from premenstrual syndrome (PMS)_: OCs can alleviate PMS symptoms, such as breast tenderness, mood swings, and bloating.\n\n4. _Treatment of acne_: OCs can help reduce acne by decreasing androgen hormones.\n\n5. _Reduction of risk of ovarian cysts_: OCs can reduce the risk of ovarian cysts and torsion.\n\n6. _Reduction of risk of endometrial and ovarian cancer_: Long-term use of OCs can reduce the risk of endometrial and ovarian cancer.\n\n7. _Relief from dysmenorrhea_: OCs can help alleviate painful menstrual cramps.\n\n8. _Treatment of hirsutism_: OCs can help reduce excessive hair growth in women with hirsutism.\n\n9. _Relief from migraines_: Some OCs can help reduce the frequency and severity of migraines.\n\n10. _Improved bone density_: OCs can help improve bone density, reducing the risk of osteoporosis.\n\n11. _Reduced risk of ectopic pregnancy_: OCs can reduce the risk of ectopic pregnancy.\n\n12. _Improved menstrual hygiene_: OCs can help reduce menstrual bleeding, making it easier to manage menstruation.\n\nThese non-contraceptive benefits make OCs a valuable option for many women, even if they are not seeking contraception.
List the causes of Nipple Retraction and treatment	Causes of nipple retraction include:\n\n1. _Breastfeeding difficulties_: Poor latching or sucking technique can cause nipple retraction.\n2. _Breast engorgement_: Swelling of the breast tissue can push the nipple inward.\n3. _Mastitis_: Breast infection can cause nipple retraction.\n4. _Ductal ectasia_: Widening of the milk ducts can lead to nipple retraction.\n5. _Breast cancer_: In rare cases, nipple retraction can be a symptom of breast cancer.\n6. _Surgery or trauma_: Injury or surgery can cause scarring, leading to nipple retraction.\n7. _Genetic predisposition_: Some women may be born with naturally inverted nipples.\n\nSymptoms of nipple retraction include:\n\n- Nipple is pulled inward or recessed\n- Difficulty breastfeeding or latching\n- Pain or discomfort\n- Redness or swelling\n- Discharge or bleeding\n\nTreatment for nipple retraction depends on the underlying cause and may include:\n\n- Breastfeeding support and guidance\n- Nipple shields or shells\n- Manual expression or pumping\n- Antibiotics for infection\n- Surgery in severe cases
Define Nipple Retraction	Nipple retraction, also known as nipple inversion or invaginated nipple, is a condition where the nipple is pulled inward, becoming recessed or retracted into the breast tissue. This can occur in one or both breasts.
Define breast engorgement and state the causes commonly seen in Africa	Breast engorgement is a condition where the breasts become swollen, tender, and painful due to an accumulation of milk, blood, and other fluids. This can occur in lactating women, especially during the early days of breastfeeding.\n\nCommon causes of breast engorgement in Africa include:\n\n1. _Delayed breastfeeding initiation_: Not breastfeeding immediately after delivery can lead to milk accumulation and engorgement.\n2. _Infrequent breastfeeding_: Not breastfeeding frequently enough can cause milk to build up and lead to engorgement.\n3. _Poor latching technique_: Incorrect latching can lead to ineffective milk removal, causing engorgement.\n4. _Overproduction of milk_: Some women may produce more milk than their baby needs, leading to engorgement.\n5. _Hormonal changes_: Fluctuations in hormone levels during the postpartum period can contribute to engorgement.\n6. _Traditional practices_: Some traditional practices, such as tight binding or compression of the breasts, can restrict milk flow and lead to engorgement.\n7. _Inadequate support_: Lack of proper breastfeeding support and guidance can contribute to engorgement.\n8. _Mastitis_: Breast infection can cause engorgement, swelling, and pain.\n9. _Blocked milk ducts_: Obstruction of milk ducts can lead to milk accumulation and engorgement.\n\nIn Africa, additional factors that may contribute to breast engorgement include:\n\n1. _Cultural beliefs and practices_\n2. _Limited access to breastfeeding support and education_\n3. _High parity_ (having many children)\n4. _Malnutrition_ or poor diet\n5. _HIV/AIDS_ or other underlying medical conditions
Define induction of labour, and state methods for induction of labour	Induction of labor is the process of stimulating uterine contractions to help a woman's body begin labor, usually when there is a medical reason to deliver the baby. This can be done using various methods, including:\n\n1. _Pharmacological induction_: Using medications like oxytocin, misoprostol, or dinoprostone to stimulate contractions.\n2. _Mechanical induction_: Using techniques like breaking the water (amniotomy), inserting a Foley catheter, or applying gentle pressure to the cervix.\n3. _Natural induction_: Using non-medical methods like nipple stimulation, walking, or sex to stimulate contractions.\n
State the parameters in the modified bishops score \nAnd what way has it helped the practice of obstetrics amongst African doctors	The Modified Bishop Score (MBS) is a system used to assess the readiness of the cervix for induction of labor. The parameters are:\n\n1. *Dilation* (0-3 points): 0 = closed, 1 = 1-2 cm, 2 = 3-4 cm, 3 = 5 cm or more\n2. *Effacement* (0-3 points): 0 = 0-30%, 1 = 31-50%, 2 = 51-70%, 3 = 71% or more\n3. *Station* (0-3 points): 0 = -3 or above, 1 = -2, 2 = -1 or 0, 3 = +1 or below\n4. *Consistency* (0-2 points): 0 = firm, 1 = medium, 2 = soft\n5. *Position* (0-2 points): 0 = posterior, 1 = mid-position, 2 = anterior\n\nThe total score ranges from 0 to 13 points.\n\nThe Modified Bishop Score has helped the practice of obstetrics amongst African doctors in several ways:\n\n1. *Standardized assessment*: MBS provides a standardized way to assess cervical readiness, reducing variability in clinical decisions.\n2. *Improved induction outcomes*: By identifying women with favorable cervical conditions, MBS helps doctors optimize induction timing, reducing the risk of failed inductions and complications.\n3. *Reduced cesarean sections*: MBS helps doctors identify women who may not require cesarean sections, promoting vaginal deliveries and reducing surgical risks.\n4. *Enhanced patient safety*: MBS guides doctors in making informed decisions about labor management, reducing the risk of maternal and fetal complications.\n5. *Training and education*: MBS serves as a teaching tool, helping African doctors develop skills in cervical assessment and labor management.\n\nBy adopting the Modified Bishop Score, African doctors have improved their ability to manage labor and induction, leading to better outcomes for mothers and babies.
Define preeclampsia state it's complications and risk factors	Preeclampsia is a pregnancy complication characterized by:\n\n1. High blood pressure (hypertension): Blood pressure ≥140/90 mmHg after 20 weeks of gestation.\n2. Proteinuria: Presence of excess protein in the urine (≥300 mg in 24 hours).\n\nPreeclampsia can lead to severe complications for both mother and baby, including:\n\n1. Placental abruption\n2. Premature birth\n3. Low birth weight\n4. Maternal organ damage (kidneys, liver, brain)\n5. Seizures (eclampsia)\n6. Stroke\n7. Cardiovascular disease\n\nRisk factors for preeclampsia include:\n\n1. First pregnancy\n2. History of preeclampsia in a previous pregnancy\n3. Family history of preeclampsia\n4. Multiple pregnancy\n5. Chronic medical conditions (hypertension, diabetes, kidney disease)\n6. Age ≥35 years\n\n
Define Rhesus Isoimmunization	Rhesus (Rh) isoimmunization is a condition that occurs when a woman with Rh-negative blood is exposed to Rh-positive blood, usually during pregnancy, childbirth, or blood transfusion. This exposure triggers an immune response, causing the woman's body to produce antibodies against the Rh-positive blood cells.
How has the use of partograph helped in reducing maternal mortality in African countries	The partograph has significantly contributed to reducing maternal mortality in African countries in several ways:\n\n1. *Improved monitoring*: Partographs help healthcare providers track labor progress, identifying potential complications early.\n2. *Early detection of abnormalities*: Partographs facilitate early detection of abnormal labor patterns, allowing for timely interventions.\n3. *Reduced labor duration*: Partographs help healthcare providers manage labor more effectively, reducing prolonged labor.\n4. *Increased access to emergency care*: Partographs facilitate timely referrals to emergency care when necessary.\n5. *Enhanced decision-making*: Partographs provide a clear visual representation of labor progress, supporting informed decision-making.\n6. *Improved communication*: Partographs facilitate communication among healthcare providers, ensuring continuity of care.\n7. *Reduced postpartum hemorrhage*: Partographs help identify women at risk of postpartum hemorrhage, enabling early intervention.\n8. *Increased accountability*: Partographs promote accountability among healthcare providers, ensuring that they follow established protocols.\n\nBy adopting partographs, African countries have seen a significant reduction in maternal mortality rates. According to the World Health Organization (WHO), the use of partographs has contributed to:\n\n- A 50% reduction in maternal mortality in some African countries\n- A 30% reduction in stillbirths\n- A 25% reduction in neonatal mortality\n\nThe partograph is a simple, effective tool that has made a significant impact on maternal healthcare in Africa. Its continued use and promotion are essential for further reducing maternal mortality and improving healthcare outcomes.
List some obstetrics risk factors for anemia in pregnancy amongst Nigerian women	Obstetric risk factors for anemia in pregnancy amongst Nigerian women include:\n\n1. _Multiple pregnancies_: Carrying twins or more increases the risk of anemia.\n2. _High parity_: Having many children increases the risk of anemia.\n3. _Short inter-pregnancy interval_: Less than two years between pregnancies increases the risk of anemia.\n4. _Previous history of anemia_: Women who had anemia in previous pregnancies are at higher risk.\n5. _Malaria_: Frequent malaria attacks increase the risk of anemia.\n6. _HIV/AIDS_: Women with HIV/AIDS are more susceptible to anemia.\n7. _Poor antenatal care_: Inadequate or infrequent prenatal check-ups increase the risk of anemia.\n8. _Teenage pregnancy_: Adolescent pregnant women are at higher risk of anemia.\n9. _Grand multiparity_: Women who have had many children (five or more) are at higher risk of anemia.\n10. _History of postpartum hemorrhage_: Women who experienced excessive bleeding after previous deliveries are at higher risk of anemia.\n11. _Chronic medical conditions_: Women with conditions like sickle cell disease, thalassemia, or chronic kidney disease are at higher risk of anemia.\n12. _Poor nutrition and dietary habits_: Inadequate iron and folic acid intake increase the risk of anemia.\n13. _Pregnancy-induced hypertension_: Women with high blood pressure during pregnancy are at higher risk of anemia.\n14. _Placenta previa_: Women with placenta previa are at higher risk of anemia due to bleeding.\n15. _Fetal growth restriction_: Women with fetal growth restriction are at higher risk of anemia.
What are the cardinal motions involved in the mechanism of labour	The cardinal motions involved in the mechanism of labor are:\n\n1. *Engagement*: The fetal head enters the pelvis.\n2. *Descent*: The fetal head moves downward through the pelvis.\n3. *Flexion*: The fetal head flexes, or bends, as it moves through the pelvis.\n4. *Internal Rotation*: The fetal head rotates to align with the mother's pelvis.\n5. *Extension*: The fetal head extends, or straightens, as it crowns.\n6. *External Rotation*: The fetal head rotates to align with the mother's pelvis after delivery.\n7. *Expulsion*: The fetus is pushed out of the birth canal.\n\nThese cardinal motions help guide the fetus through the pelvis and birth canal during labor, ensuring a safe and successful delivery.
What are the medical and surgical treatment options for post partum hemorrhage	Medical treatment options for postpartum hemorrhage (PPH) include:\n\n1. _Uterine massage_: Massaging the uterus to help control bleeding.\n2. _Oxytocin_: Administering oxytocin to stimulate uterine contractions.\n3. _Methylergometrine_: Using methylergometrine to induce uterine contractions.\n4. _Prostaglandins_: Administering prostaglandins to stimulate uterine contractions.\n5. _Tranexamic acid_: Using tranexamic acid to reduce bleeding.\n6. _Fluid resuscitation_: Administering fluids and blood products to replace lost blood volume.\n7. _Antibiotics_: Prescribing antibiotics to prevent infection.\n\nSurgical treatment options for PPH include:\n\n1. _Uterine artery ligation_: Ligating the uterine arteries to reduce blood flow.\n2. _Internal iliac artery ligation_: Ligating the internal iliac arteries to reduce blood flow.\n3. _B-Lynch suture_: Performing a B-Lynch suture to compress the uterus.\n4. _Uterine tamponade_: Using a balloon or gauze to tamponade the uterus.\n5. _Hysterectomy_: Performing a hysterectomy as a last resort to control bleeding.\n\nAdditional interventions may include:\n\n1. _Intrauterine balloon tamponade_: Using a balloon to tamponade the uterus.\n2. _Uterine packing_: Packing the uterus with gauze to control bleeding.\n3. _Angiographic embolization_: Using angiographic embolization to occlude bleeding vessels.\n
What is the classical definition of post partum hemorrhage \nState why it is common in Nigeria	The classical definition of postpartum hemorrhage (PPH) is:\n\n- Bleeding from the genital tract exceeding 500 mL within the first 24 hours after spontaneous vagina delivery or 1000 mL following caesarean section\n\nPPH is common in Nigeria due to various factors, including:\n\n1. _Poor access to quality healthcare_: Limited availability of skilled healthcare providers, especially in rural areas.\n2. _High prevalence of anemia_: Widespread anemia among pregnant women increases the risk of PPH.\n3. _Hypertension and preeclampsia_: Common conditions in Nigerian pregnant women, increasing the risk of PPH.\n4. _Multiple pregnancies and high parity_: Higher risk of PPH in women with multiple pregnancies or high parity.\n5. _Traditional birth practices_: Home deliveries without skilled attendants, increasing the risk of PPH.\n6. _Limited availability of blood transfusion services_: Inadequate blood supply and lack of compatible blood types.\n7. _Poor infrastructure and transportation_: Delays in accessing healthcare facilities, especially in emergency situations.\n8. _Lack of adequate training and equipment_: Healthcare providers may not have the necessary skills or equipment to manage PPH effectively.\n9. _Cultural and socioeconomic factors_: Limited awareness, education, and financial resources contribute to the high incidence of PPH.\n10. _High maternal mortality rate_: PPH is a leading cause of maternal mortality in Nigeria, highlighting the need for improved healthcare services.\n\nAddressing these factors is crucial to reducing the incidence of PPH in Nigeria and improving maternal health outcomes.
State the Amsel criteria for bacterial vaginosis	The Amsel criteria for bacterial vaginosis (BV) include:\n\n1. _Homogeneous, thin, white or gray discharge_ that coats the vaginal walls\n2. _pH of vaginal fluid > 4.5_ (normal pH is < 4.5)\n3. _Presence of clue cells_ (vaginal epithelial cells with adherent bacteria) on microscopic examination\n4. _Positive whiff test_ (release of a strong fishy odor when vaginal discharge is mixed with potassium hydroxide)\n\nTo diagnose BV, at least three of the four Amsel criteria must be present.\n\n\n\n- Clue cells are a key diagnostic feature, as they indicate the presence of Gardnerella vaginalis and other anaerobic bacteria.\n- The whiff test is not always positive, but it can support the diagnosis.\n- Vaginal pH testing can help rule out other conditions, such as trichomoniasis or yeast infections.\n
What are the leading causes of vaginal discharge in reproductive age African women seen in gynaecology practice	The leading causes of vaginal discharge in reproductive age African women seen in gynecology practice include:\n\n1. _Bacterial vaginosis_ (BV): Caused by an imbalance of vaginal bacteria.\n2. _Trichomoniasis_: A sexually transmitted infection (STI) caused by Trichomonas vaginalis.\n3. _Candidiasis_: A fungal infection caused by Candida albicans.\n4. _Cervicitis_: Inflammation of the cervix, often caused by STIs like chlamydia or gonorrhea.\n5. _Pelvic inflammatory disease_ (PID): Infection of the reproductive organs, often caused by STIs.\n6. _Vaginal trichomoniasis_: An STI caused by Trichomonas vaginalis.\n7. _Chlamydia_: An STI caused by Chlamydia trachomatis.\n8. _Gonorrhea_: An STI caused by Neisseria gonorrhoeae.\n9. _Vaginal atrophy_: Thinning and drying of vaginal tissues due to hormonal changes.\n10. _Foreign body_: Presence of an object in the vagina, such as a forgotten tampon.\n11. _Cervical ectopy_: A condition where the cervical cells grow outside the cervix.\n12. _Vaginal infections_ caused by other microorganisms like E. coli, Staphylococcus aureus, and Haemophilus influenzae.
What are the types of placenta previa and what is the treatment option for each	There are four types of placenta previa, classified based on the location and extent of placental coverage of the internal cervical os:\n\n1. *Type 1: Low-lying placenta*\n    - Placenta is located near the internal os, but does not cover it.\n    - Treatment: Expectant management, vaginal delivery possible.\n2. *Type 2: Marginal placenta previa*\n    - Placenta covers the internal os partially.\n    - Treatment: Expectant management, vaginal delivery possible, but may require cesarean section.\n3. *Type 3: Partial placenta previa*\n    - Placenta covers the internal os partially, but extends into the cervical canal.\n    - Treatment: Cesarean section recommended, as vaginal delivery may cause severe bleeding.\n4. *Type 4: Complete placenta previa*\n    - Placenta completely covers the internal os and extends into the cervical canal.\n    - Treatment: Cesarean section necessary, as vaginal delivery is not possible.\n\nAdditional treatment options may include:\n\n- *Corticosteroids*: To promote fetal lung maturity in case of preterm delivery.\n- *Tocolytics*: To delay delivery in case of preterm labor.\n- *Blood transfusions*: To manage excessive bleeding.\n- *Bed rest*: To reduce bleeding and promote fetal growth.\n- *Pelvic rest*: Avoiding intercourse, tampons, and vaginal exams to reduce bleeding risk.
Define antepartum Hemorrhage and state why it is common amongst Africans	Antepartum hemorrhage (APH) is defined as vaginal bleeding that occurs after the 28th week of gestation, but before labor begins. It is a serious complication of pregnancy that can threaten the life of both the mother and the fetus.\n\nAPH is common amongst Africans due to various factors, including:\n\n1. _High prevalence of hypertension and preeclampsia_: These conditions increase the risk of placental abruption, a leading cause of APH.\n2. _Poor access to prenatal care_: Inadequate monitoring and delayed diagnosis of pregnancy complications contribute to APH.\n3. _High incidence of malaria and anemia_: These conditions can lead to placental insufficiency and increase the risk of APH.\n4. _Genetic predisposition_: Women of African descent are more likely to have inherited bleeding disorders, such as sickle cell disease.\n5. _Limited access to blood transfusion services_: Inadequate blood supply and lack of compatible blood types can worsen APH outcomes.\n6. _Poor nutritional status_: Inadequate nutrition can contribute to anemia and poor pregnancy outcomes.\n7. _High parity and short inter-pregnancy intervals_: These factors increase the risk of placental abruption and APH.\n8. _Limited availability of emergency obstetric care_: Delays in receiving timely and appropriate care can worsen APH outcomes.\n\nThese factors contribute to the higher incidence of APH amongst African women, highlighting the need for improved prenatal care, access to emergency obstetric services, and addressing underlying health conditions.
